video_id,channel_id,title,description,publishedAt,categoryId,viewCount,likeCount,dislikeCount,commentCount,topicId,video_title,published,video_views,video_madeforkids,video_likes,video_comment_count,video_length,video_title_clean
lmH5uqwaFq8,,,,,,,,,,,Airplane Song CoComelon Nursery Rhymes Kids Songs,2022-11-01T07:00:15Z,2414840,True,13417,0,2:59,Airplane Song CoComelon Nursery Rhymes Kids Songs
0SY0Yn0yF9o,,,,,,,,,,,Wheels On The Bus More Nursery Rhymes Kids Songs Lellobee by CoComelon,2022-10-29T07:00:00Z,2732527,True,14721,0,29:52,Wheels On The Bus More Nursery Rhymes Kids Songs Lellobee by CoComelon
sNyF7BvVfxs,,,,,,,,,,,Bingos Bath Song CoComelon Nursery Rhymes Kids Songs,2022-10-25T07:00:16Z,8441023,True,47178,0,2:49,Bingos Bath Song CoComelon Nursery Rhymes Kids Songs
K4kqqCzF-BA,,,,,,,,,,,Play Outside at the Beach Song More Nursery Rhymes Kids Songs CoComelon,2022-10-22T07:00:12Z,11385375,True,56762,0,1:1:21,Play Outside at the Beach Song More Nursery Rhymes Kids Songs CoComelon
gfZmvllWVwY,,,,,,,,,,,Halloween Song Dance Dance Party CoComelon Nursery Rhymes Kids Songs,2022-10-18T07:00:19Z,8653196,True,45845,0,2:39,Halloween Song Dance Dance Party CoComelon Nursery Rhymes Kids Songs
Ay3m-zZ4KLs,,,,,,,,,,,Silly Halloween Song More Nursery Rhymes Kids Songs CoComelon,2022-10-15T07:00:08Z,14590957,True,81708,0,29:,Silly Halloween Song More Nursery Rhymes Kids Songs CoComelon
mbPNkDEN3Ps,,,,,,,,,,,Yes Yes Fruits Song CoComelon Nursery Rhymes Kids Songs,2022-10-11T07:00:16Z,18256957,True,83433,0,3:29,Yes Yes Fruits Song CoComelon Nursery Rhymes Kids Songs
kSx1tS52ov4,,,,,,,,,,,Red Light Green Light Song More Nursery Rhymes Kids Songs CoComelon,2022-10-07T23:00:34Z,14149224,True,69788,0,56:41,Red Light Green Light Song More Nursery Rhymes Kids Songs CoComelon
o3eMkWX8E7U,,,,,,,,,,,Silly Halloween Song CoComelon Nursery Rhymes Kids Songs,2022-10-04T07:00:31Z,11797544,True,56627,0,2:49,Silly Halloween Song CoComelon Nursery Rhymes Kids Songs
o1YenjwOp-A,,,,,,,,,,,Lets Go Camping Song More Nursery Rhymes Kids Songs CoComelon,2022-10-01T07:00:17Z,12541176,True,70270,0,34:54,Lets Go Camping Song More Nursery Rhymes Kids Songs CoComelon
hqFfJBOrvHw,,,,,,,,,,,Humpty Dumpty Song Dance Dance Party CoComelon Nursery Rhymes Kids Songs,2022-09-27T07:00:15Z,8730874,True,33143,0,2:42,Humpty Dumpty Song Dance Dance Party CoComelon Nursery Rhymes Kids Songs
QYTYKUMOuwo,,,,,,,,,,,Fire Truck Fun Song More Nursery Rhymes Kids Songs CoComelon,2022-09-24T07:00:08Z,14542961,True,75417,0,1:10,Fire Truck Fun Song More Nursery Rhymes Kids Songs CoComelon
biXYtxZnChQ,,,,,,,,,,,How to Be a Hero Song CoComelon Nursery Rhymes Kids Songs,2022-09-20T07:53:06Z,11815458,True,44899,0,2:58,How to Be a Hero Song CoComelon Nursery Rhymes Kids Songs
tkTYVy5sdIg,,,,,,,,,,,Play Outside At The Train Park Song More Nursery Rhymes Kids Songs CoComelon,2022-09-17T07:18:34Z,14271249,True,77538,0,56:52,Play Outside At The Train Park Song More Nursery Rhymes Kids Songs CoComelon
-4nWoQwSHGE,,,,,,,,,,,JJs Treehouse Song CoComelon Nursery Rhymes Kids Songs,2022-09-13T07:04:39Z,11733553,True,56260,0,3:14,JJs Treehouse Song CoComelon Nursery Rhymes Kids Songs
zhoVe42Pxb0,,,,,,,,,,,Yes Yes Vegetables On The Farm More Nursery Rhymes Kids Songs CoComelon,2022-09-10T07:00:31Z,19127753,True,88329,0,35:46,Yes Yes Vegetables On The Farm More Nursery Rhymes Kids Songs CoComelon
lkBlyggtYhA,,,,,,,,,,,Train Song Dance Dance Party CoComelon Nursery Rhymes Kids Songs,2022-09-06T07:00:11Z,16980470,True,63212,0,2:56,Train Song Dance Dance Party CoComelon Nursery Rhymes Kids Songs
3rKIRUm5oV4,,,,,,,,,,,I Spy Song More Nursery Rhymes Kids Songs CoComelon,2022-09-03T07:00:01Z,16138519,True,71547,0,54:50,I Spy Song More Nursery Rhymes Kids Songs CoComelon
3QFTTxD7SuY,,,,,,,,,,,Fire Truck Song Trucks For Kids CoComelon Nursery Rhymes Kids Songs,2022-08-30T09:15:48Z,17238606,True,89074,0,3:5,Fire Truck Song Trucks For Kids CoComelon Nursery Rhymes Kids Songs
DqhH2OUOl1M,,,,,,,,,,,The Wheels on the Bus Dance CoComelon Nursery Rhymes Kids Songs Dance Party,2022-08-27T07:00:03Z,22114376,True,84358,0,28:18,The Wheels on the Bus Dance CoComelon Nursery Rhymes Kids Songs Dance Party
SSe98txCv00,,,,,,,,,,,Play Outside at the Beach Song CoComelon Nursery Rhymes Kids Songs,2022-08-23T07:00:08Z,78452389,True,230139,0,2:54,Play Outside at the Beach Song CoComelon Nursery Rhymes Kids Songs
uHJN15kVTLY,,,,,,,,,,,Opposites Song More Nursery Rhymes Kids Songs CoComelon,2022-08-20T07:00:16Z,16666273,True,84174,0,59:27,Opposites Song More Nursery Rhymes Kids Songs CoComelon
zHvKlszHzCg,,,,,,,,,,,Lets Go Camping Song Summer Family Fun CoComelon Nursery Rhymes Kids Songs,2022-08-16T07:00:15Z,23137250,True,85960,0,2:52,Lets Go Camping Song Summer Family Fun CoComelon Nursery Rhymes Kids Songs
dxjciWnjd0M,,,,,,,,,,,Baa Baa Black Sheep Pretend Play Edition More Nursery Rhymes Kids Songs CoComelon,2022-08-13T07:00:19Z,16192850,True,69019,0,31:30,Baa Baa Black Sheep Pretend Play Edition More Nursery Rhymes Kids Songs CoComelon
3LEW8jG-Q5Y,,,,,,,,,,,Yes Yes Vegetables On The Farm CoComelon Nursery Rhymes Kids Songs,2022-08-09T07:00:02Z,21406792,True,99533,0,4:10,Yes Yes Vegetables On The Farm CoComelon Nursery Rhymes Kids Songs
usqngNJYnug,,,,,,,,,,,Shopping Cart Song More Nursery Rhymes Kids Songs CoComelon,2022-08-06T07:00:30Z,51859000,True,250591,0,49:33,Shopping Cart Song More Nursery Rhymes Kids Songs CoComelon
3e_KEVMUvuo,,,,,,,,,,,Los Pollitos Dicen Dance Dance Party CoComelon Nursery Rhymes Kids Songs,2022-08-02T15:12:30Z,11751701,True,53584,0,2:51,Los Pollitos Dicen Dance Dance Party CoComelon Nursery Rhymes Kids Songs
NSlWgxDFbe8,,,,,,,,,,,Birthday At The Farm Song More Nursery Rhymes Kids Songs CoComelon,2022-07-30T12:40:42Z,26283087,True,132383,0,35:29,Birthday At The Farm Song More Nursery Rhymes Kids Songs CoComelon
f_8Bce7Y_p4,,,,,,,,,,,Finger Family Song More Nursery Rhymes Kids Songs CoComelon,2022-07-28T07:00:20Z,11895044,True,58002,0,29:33,Finger Family Song More Nursery Rhymes Kids Songs CoComelon
G_MubFgSHdI,,,,,,,,,,,Baa Baa Black Sheep CoComelon Nursery Rhymes Kids Songs,2022-07-26T07:00:07Z,17755313,True,85066,0,2:55,Baa Baa Black Sheep CoComelon Nursery Rhymes Kids Songs
-BztdXchohU,,,,,,,,,,,Birthday Song More Nursery Rhymes Kids Songs CoComelon,2022-07-23T09:02:11Z,19513984,True,113731,0,35:42,Birthday Song More Nursery Rhymes Kids Songs CoComelon
tztm8t46_hI,,,,,,,,,,,Big Brother Song More Nursery Rhymes Kids Songs CoComelon,2022-07-21T07:00:30Z,16335478,True,54558,0,56:39,Big Brother Song More Nursery Rhymes Kids Songs CoComelon
ep2qRkyIjek,,,,,,,,,,,JJs Birthday At The Farm Song CoComelon Nursery Rhymes Kids Songs,2022-07-19T07:00:13Z,12954114,True,66845,0,2:56,JJs Birthday At The Farm Song CoComelon Nursery Rhymes Kids Songs
GbRm5DFfl88,,,,,,,,,,,Baa Baa Black Sheep Dance Dance Party  More Nursery Rhymes Kids Songs CoComelon,2022-07-15T23:00:05Z,6993376,True,41835,0,26:3,Baa Baa Black Sheep Dance Dance Party  More Nursery Rhymes Kids Songs CoComelon
Xxa-wbT93QU,,,,,,,,,,,Codys Spy Song More Nursery Rhymes Kids Songs CoComelon,2022-07-14T07:00:17Z,10463592,True,53558,0,35:5,Codys Spy Song More Nursery Rhymes Kids Songs CoComelon
Xf4XemBwzDY,,,,,,,,,,,JJs Birthday Surprise Song CoComelon Nursery Rhymes Kids Songs,2022-07-12T07:35:30Z,43150651,True,115727,0,2:56,JJs Birthday Surprise Song CoComelon Nursery Rhymes Kids Songs
dfRBIE3AE34,,,,,,,,,,,Go Before You Go Song More Nursery Rhymes Kids Songs CoComelon,2022-07-09T07:00:14Z,15496591,True,85182,0,34:47,Go Before You Go Song More Nursery Rhymes Kids Songs CoComelon
LA2q3QwhG54,,,,,,,,,,,Belly Button Dance Dance Party CoComelon Nursery Rhymes Kids Songs,2022-07-05T16:00:33Z,31758072,True,105908,0,2:42,Belly Button Dance Dance Party CoComelon Nursery Rhymes Kids Songs
FGcXy0MZ3Ys,,,,,,,,,,,Twinkle Twinkle Little Star More Nursery Rhymes Kids Songs CoComelon,2022-07-01T23:00:11Z,34242590,True,135938,0,49:13,Twinkle Twinkle Little Star More Nursery Rhymes Kids Songs CoComelon
iWwDq7-TCo4,,,,,,,,,,,Go Before You Go Song CoComelon Nursery Rhymes Kids Songs,2022-06-28T07:00:11Z,12117976,True,59663,0,3:8,Go Before You Go Song CoComelon Nursery Rhymes Kids Songs
j7DH5splyoY,,,,,,,,,,,London Bridge More Nursery Rhymes Kids Songs CoComelon,2022-06-25T07:00:13Z,31054786,True,136958,0,59:43,London Bridge More Nursery Rhymes Kids Songs CoComelon
U5Inxa3jK0Y,,,,,,,,,,,Freeze Dance Dance Party CoComelon Nursery Rhymes Kids Songs,2022-06-21T07:00:08Z,36897428,True,97344,0,2:47,Freeze Dance Dance Party CoComelon Nursery Rhymes Kids Songs
Zre4vqUAgHU,,,,,,,,,,,Wheels On The Bus More Nursery Rhymes Kids Songs CoComelon,2022-06-18T07:00:17Z,41304065,True,173420,0,38:52,Wheels On The Bus More Nursery Rhymes Kids Songs CoComelon
hqzvHfy-Ij0,,,,,,,,,,,Twinkle Twinkle Little Star CoComelon Nursery Rhymes Kids Songs,2022-06-14T07:00:10Z,38761703,True,149878,0,3:16,Twinkle Twinkle Little Star CoComelon Nursery Rhymes Kids Songs
LCwxpu1uV60,,,,,,,,,,,Pets For Kids Song More Nursery Rhymes Kids Songs CoComelon,2022-06-11T07:00:06Z,27125634,True,105895,0,1:44,Pets For Kids Song More Nursery Rhymes Kids Songs CoComelon
Lig3cP174Jo,,,,,,,,,,,Following In Dads Footsteps Song CoComelon Nursery Rhymes Kids Songs,2022-06-07T07:00:13Z,14719863,True,65448,0,3:13,Following In Dads Footsteps Song CoComelon Nursery Rhymes Kids Songs
uCNLiwNFvuc,,,,,,,,,,,Head Shoulders Knees and Toes More Nursery Rhymes Kids Songs CoComelon,2022-06-04T07:00:13Z,23138673,True,113880,0,39:58,Head Shoulders Knees and Toes More Nursery Rhymes Kids Songs CoComelon
wwosJXWGWRY,,,,,,,,,,,London Bridge Is Falling Down Song CoComelon Nursery Rhymes Kids Songs,2022-05-31T12:59:00Z,25155551,True,111060,0,2:51,London Bridge Is Falling Down Song CoComelon Nursery Rhymes Kids Songs
TF-RmVyoEbM,,,,,,,,,,,ABC Song Spanish Edition More Nursery Rhymes Kids Songs CoComelon,2022-05-28T07:00:13Z,15139371,True,80272,0,53:40,ABC Song Spanish Edition More Nursery Rhymes Kids Songs CoComelon
FtAZUKtC0Fk,,,,,,,,,,,Wheels On The Bus Song Pretend Play Edition CoComelon Nursery Rhymes Kids Songs,2022-05-24T07:00:03Z,46687914,True,162135,0,3:11,Wheels On The Bus Song Pretend Play Edition CoComelon Nursery Rhymes Kids Songs
8XR9OzAeDqQ,,,,,,,,,,,too big waves for me,2022-10-31T11:00:05Z,750880,False,64462,4664,14:40,too big waves for me
LzCA5zHayyk,,,,,,,,,,,She fell for it,2022-10-24T20:25:38Z,1692432,False,106371,9087,32:21,She fell for it
UhjjjqmGAkI,,,,,,,,,,,Does this mean Im cursed now,2022-10-17T12:45:01Z,1522646,False,103735,7777,22:31,Does this mean Im cursed now
cLFJjMokld8,,,,,,,,,,,I took my car off road Oops,2022-10-15T13:10:55Z,1607464,False,133230,8681,9:59,I took my car off road Oops
vwfQq9IA8TA,,,,,,,,,,,I bought every single Gacha Pod Collab with PewDiePie ,2022-10-07T13:46:07Z,2564131,False,156579,9793,39:21,I bought every single Gacha Pod Collab with PewDiePie 
P8XP4oamvzk,,,,,,,,,,,Are we smarter than A Fifth Grader Collab with PewDiePie,2022-10-04T15:03:44Z,2569878,False,182935,9140,24:58,Are we smarter than A Fifth Grader Collab with PewDiePie
sIw9GwePGKg,,,,,,,,,,,My Dog was invited by The Governor of Japan Gunma,2022-09-30T14:31:12Z,2286781,False,174522,8687,18:51,My Dog was invited by The Governor of Japan Gunma
KASLwYxrILs,,,,,,,,,,,You Laugh You Spin the Wheel of PAIN,2022-09-23T19:02:24Z,2262100,False,182547,8446,15:23,You Laugh You Spin the Wheel of PAIN
DYdrFALAlZQ,,,,,,,,,,,This Dating show will make you MAD,2022-09-21T14:00:07Z,2566752,False,174748,8358,23:42,This Dating show will make you MAD
JDsuYy1qsiA,,,,,,,,,,,Our house was attacked,2022-09-19T12:58:13Z,4834187,False,284166,16829,18:8,Our house was attacked
BQ35bZAPUnk,,,,,,,,,,,Why I didnt quit,2022-09-14T11:37:26Z,4299492,False,427029,23938,7:3,Why I didnt quit
fJ2_06vAZkw,,,,,,,,,,,Felix is scared of bugs collab with PewDiePie ,2022-09-04T14:26:01Z,1952868,False,127232,7448,17:38,Felix is scared of bugs collab with PewDiePie 
qQiwgEQNfQs,,,,,,,,,,,I try EVERY Japanese SnackCollab with PewDiePie ,2022-08-31T18:36:07Z,3446957,False,193782,11110,35:34,I try EVERY Japanese SnackCollab with PewDiePie 
p1HbuJ9HYOY,,,,,,,,,,,Japanese Karaoke but I cant sing,2022-08-26T12:58:18Z,1894141,False,135725,7567,26:2,Japanese Karaoke but I cant sing
T_XxiQdCH_s,,,,,,,,,,,Stream Fails Top 1,2022-08-21T13:51:44Z,2476666,False,143612,5495,21:45,Stream Fails Top 1
MgZjlKiQxCw,,,,,,,,,,,We were warned not to go,2022-08-16T14:15:02Z,2000949,False,137101,9010,15:7,We were warned not to go
j0XyUEQYIdc,,,,,,,,,,,filming outside during my first typhoon for no good reason,2022-08-13T14:15:05Z,1922320,False,142209,6650,33:12,filming outside during my first typhoon for no good reason
aIciGms2y6A,,,,,,,,,,,you guys noticed something,2022-08-05T15:18:13Z,3065665,False,214660,11612,15:53,you guys noticed something
peSOesOoxS4,,,,,,,,,,,Proving that magic is REAL,2022-08-01T08:22:30Z,2657402,False,169472,6674,17:56,Proving that magic is REAL
n2nTd1VbsLM,,,,,,,,,,,My Dog Cringes at TikToks,2022-07-26T16:45:22Z,3326684,False,266481,18060,11:16,My Dog Cringes at TikToks
yxbO9K7lKbQ,,,,,,,,,,,A dream of mine came true today,2022-07-20T13:00:39Z,3484609,False,274707,19473,24:36,A dream of mine came true today
uakp2SrXOwQ,,,,,,,,,,,Kid wants 1500 Allowance to Buy Gucci Shoes,2022-07-19T09:15:06Z,3365896,False,182082,9125,26:43,Kid wants 1500 Allowance to Buy Gucci Shoes
ktxBUqy6PT4,,,,,,,,,,,No YouTuber dares to box me after seeing this,2022-07-11T08:31:00Z,3018735,False,216219,10859,19:34,No YouTuber dares to box me after seeing this
P1IgBdnBeQM,,,,,,,,,,,Old YouTube Was Kinda Crazy,2022-07-09T13:15:00Z,4512916,False,234577,5934,28:40,Old YouTube Was Kinda Crazy
RF9SULnbMNc,,,,,,,,,,,This was hard,2022-07-03T12:07:46Z,4025363,False,261124,12143,18:15,This was hard
vDZHCYCd5Bo,,,,,,,,,,,My 7 Billion Setup Tour,2022-07-01T00:06:28Z,5297824,False,324113,12120,22:3,My 7 Billion Setup Tour
givTOOOPEs4,,,,,,,,,,,Reacting to the greatest cringe of all time,2022-06-28T05:21:49Z,3480875,False,201607,5583,19:41,Reacting to the greatest cringe of all time
njHcxwwqxL8,,,,,,,,,,,We went to Italy,2022-06-24T23:49:00Z,3605577,False,256806,11238,23:57,We went to Italy
cmOZNxxGrJU,,,,,,,,,,,Something is seriously wrong with tiktoks ylyl,2022-06-23T13:15:02Z,2958127,False,219175,4539,12:41,Something is seriously wrong with tiktoks ylyl
XQ93AQ2uCBM,,,,,,,,,,,I accidentally got 2 cars,2022-06-15T09:51:20Z,4198327,False,305425,16096,14:32,I accidentally got 2 cars
HNChn7eK1tM,,,,,,,,,,,Jaiden Smith Did it Again,2022-06-12T08:00:04Z,4329847,False,241121,8383,13:44,Jaiden Smith Did it Again
HcrGMcJJWfc,,,,,,,,,,,New Member to the Family,2022-06-08T22:35:09Z,5951607,False,396882,18121,18:28,New Member to the Family
D0-IrQY4ix8,,,,,,,,,,,Why Japan,2022-06-06T12:31:29Z,4650023,False,310518,11549,25:20,Why Japan
aXVr_zZqGKg,,,,,,,,,,,We Failed,2022-05-31T10:31:04Z,6104954,False,426550,19387,19:25,We Failed
adspgeE7ndU,,,,,,,,,,,I JUST MORBED,2022-05-26T09:42:16Z,4447626,False,296890,9552,14:8,I JUST MORBED
yNsIh0ciYiI,,,,,,,,,,,This show is PEAK Entertainment,2022-05-23T07:30:13Z,4748756,False,290704,9349,16:11,This show is PEAK Entertainment
mdNEZlLkPA4,,,,,,,,,,,First time driving in Japan,2022-05-21T09:15:02Z,5500172,False,422145,23642,16:15,First time driving in Japan
R55ACTWHvBY,,,,,,,,,,,cant believe markiplier did this to me,2022-05-18T22:46:23Z,4111402,False,308419,10800,13:25,cant believe markiplier did this to me
ZBgJJPZjg2k,,,,,,,,,,,whats next,2022-05-15T08:11:54Z,6194311,False,561463,25587,8:19,whats next
N2N5ZwX6U20,,,,,,,,,,,It finally happened,2022-05-09T22:56:04Z,8223320,False,829577,44997,13:58,It finally happened
F-yEoHL7MYY,,,,,,,,,,,I tried to beat Elden Ring Without Dying,2022-04-30T16:40:18Z,7629868,False,376597,15242,53:47,I tried to beat Elden Ring Without Dying
Ahzrv1TQGHY,,,,,,,,,,,Caught in 4K,2022-04-24T16:11:07Z,3408406,False,214828,5866,13:14,Caught in 4K
Td4Pd_9oyn8,,,,,,,,,,,I went to a rave it didnt go well,2022-04-21T17:08:23Z,2275271,False,120218,3922,12:54,I went to a rave it didnt go well
YM3uJ6RtBZM,,,,,,,,,,,I cant believe this is real,2022-04-15T17:34:51Z,3416077,False,254114,6406,14:11,I cant believe this is real
pqh4LfPeCYs,,,,,,,,,,,I Try Every Massager on Wish,2022-04-11T16:40:44Z,2517113,False,200161,6556,15:28,I Try Every Massager on Wish
fUWn6BYrYK8,,,,,,,,,,,She Lied about Her Age And Size 90 day Fiance,2022-04-05T16:32:35Z,4189887,False,191275,6437,20:36,She Lied about Her Age And Size 90 day Fiance
RF78s4nphEY,,,,,,,,,,,You Blaff u Bloof success,2022-03-31T16:45:00Z,2662078,False,182272,4097,10:43,You Blaff u Bloof success
-fWXLAkHmxA,,,,,,,,,,,Hitman VR is Hilariously Bad,2022-03-29T18:24:38Z,3573305,False,207032,6379,19:43,Hitman VR is Hilariously Bad
JIz0-6_mPIE,,,,,,,,,,,Gender Reveals Are Something Else,2022-03-24T17:30:02Z,3212577,False,193378,6459,22:46,Gender Reveals Are Something Else
73XDeGdl94w,,,,,,,,,,,My Workout 10 Muscle increase,2022-03-18T19:08:34Z,3291804,False,214414,10190,20:58,My Workout 10 Muscle increase
YlvcFJOE-OE,,,,,,,,,,,Giving iPhones Instead Of Candy on Halloween,2022-11-02T21:00:01Z,507560,False,82985,2163,40,Giving iPhones Instead Of Candy on Halloween
iogcY_4xGjo,,,,,,,,,,,1 vs 1000000 Hotel Room,2022-10-22T21:00:00Z,52356337,False,2831043,95561,15:41,1 vs 1000000 Hotel Room
S_CUEOBZ0P4,,,,,,,,,,,The Rock Vs MrBeast For 100000,2022-10-21T20:00:06Z,57942060,False,5444689,31385,55,The Rock Vs MrBeast For 100000
gHzuabZUd6c,,,,,,,,,,,Survive 100 Days In Circle Win 500000,2022-09-24T19:59:59Z,64951336,False,2914929,81440,17:57,Survive 100 Days In Circle Win 500000
65fN_OUawjk,,,,,,,,,,,100 Person Extreme Hide Seek,2022-09-03T19:59:59Z,47190662,False,2146575,61792,12:23,100 Person Extreme Hide Seek
jdMNoQE3mIQ,,,,,,,,,,,I Survived A Plane Crash,2022-08-20T20:00:00Z,62839702,False,2602064,75157,8:14,I Survived A Plane Crash
2isYuQZMbdU,,,,,,,,,,,I Gave My 100000000th Subscriber An Island,2022-08-04T19:59:59Z,78108529,False,4068893,228787,15:31,I Gave My 100000000th Subscriber An Island
dZklZVaU4AI,,,,,,,,,,,100000000 Subscriber Special,2022-07-31T21:00:01Z,23114436,False,1444963,91898,15,100000000 Subscriber Special
tVWWp1PqDus,,,,,,,,,,,100 Girls Vs 100 Boys For 500000,2022-07-23T20:00:09Z,89021333,False,3256331,136716,16:53,100 Girls Vs 100 Boys For 500000
vaIgyRoUkQI,,,,,,,,,,,I Didnt Eat Food For 30 Days,2022-07-02T20:00:02Z,55750004,False,2603047,101819,13:4,I Didnt Eat Food For 30 Days
Hwybp38GnZw,,,,,,,,,,,I Built Willy Wonkas Chocolate Factory,2022-06-04T20:00:02Z,116569846,False,4731215,175712,17:1,I Built Willy Wonkas Chocolate Factory
hD1YtmKXNb4,,,,,,,,,,,10000 Every Day You Survive Prison,2022-04-09T20:00:00Z,107020773,False,3799268,156071,13:59,10000 Every Day You Survive Prison
LnlKwzc_TNA,,,,,,,,,,,Would You Swim With Sharks For 100000,2022-03-19T20:02:32Z,95883393,False,3106652,103135,9:1,Would You Swim With Sharks For 100000
3jS_yEK8qVI,,,,,,,,,,,Worlds Most Dangerous Escape Room,2022-01-29T21:00:01Z,142291153,False,4229031,144977,8:1,Worlds Most Dangerous Escape Room
00NgUctWoLQ,,,,,,,,,,,Extreme 1000000 Hide And Seek,2021-12-18T21:00:00Z,75792519,False,3270048,135428,12:9,Extreme 1000000 Hide And Seek
x9TQ6culXIA,,,,,,,,,,,1000000 Influencer Tournament,2021-12-16T21:00:00Z,60217217,False,2843376,91984,12:5,1000000 Influencer Tournament
QbJJwaVdgIs,,,,,,,,,,,I Got Hunted By The Military,2021-12-10T21:30:02Z,94664751,False,3244752,97396,11:2,I Got Hunted By The Military
0e3GPea1Tyg,,,,,,,,,,,456000 Squid Game In Real Life,2021-11-24T21:00:01Z,298212759,False,14512851,611343,25:42,456000 Squid Game In Real Life
cV2gBU6hKfY,,,,,,,,,,,I Cleaned The Worlds Dirtiest Beach TeamSeas,2021-10-29T19:59:43Z,71111580,False,4698961,179274,4:55,I Cleaned The Worlds Dirtiest Beach TeamSeas
qIsgdOVGA04,,,,,,,,,,,Last To Take Hand Off Lamborghini Keeps It,2021-10-23T20:00:01Z,110430427,False,3773840,130595,15:43,Last To Take Hand Off Lamborghini Keeps It
cExLQ1o2pDw,,,,,,,,,,,First To Rob Bank Wins 100000,2021-09-26T20:00:06Z,90994817,False,3012321,123886,8:2,First To Rob Bank Wins 100000
uocETPj4Jx4,,,,,,,,,,,Extreme 500000 Game Of Tag,2021-09-04T20:00:07Z,88288480,False,3327319,101930,12:40,Extreme 500000 Game Of Tag
zxYjTTXc-J8,,,,,,,,,,,Last To Leave Circle Wins 500000,2021-08-31T20:01:03Z,206518357,False,4818963,111801,19:26,Last To Leave Circle Wins 500000
hxwpkM5w3Cc,,,,,,,,,,,I Got Hunted By The FBI,2021-08-07T23:00:03Z,112308189,False,3172788,92696,15:51,I Got Hunted By The FBI
ktyJIj6i4Qw,,,,,,,,,,,If You Can Carry 1000000 You Keep It,2021-07-24T20:00:59Z,94487488,False,2556601,74548,10:45,If You Can Carry 1000000 You Keep It
urtFrxDUV6c,,,,,,,,,,,Would YOU Quit School For 100000,2021-07-10T20:00:09Z,81355729,False,2448395,81720,11:34,Would YOU Quit School For 100000
nM89Wl03Q4g,,,,,,,,,,,I Survived 50 Hours In A Maximum Security Prison,2021-06-26T20:00:02Z,127513228,False,2781626,98974,12:38,I Survived 50 Hours In A Maximum Security Prison
NZlClr_ivb4,,,,,,,,,,,Hit The Target Win 300000,2021-06-12T20:00:01Z,112645394,False,2872666,86164,15:4,Hit The Target Win 300000
E6E22XQPhhg,,,,,,,,,,,Anything You Can Fit In The Triangle Ill Pay For,2021-06-01T20:00:02Z,98411074,False,2560796,87334,16:8,Anything You Can Fit In The Triangle Ill Pay For
TQHEJj68Jew,,,,,,,,,,,I Got Hunted By A Real Bounty Hunter,2021-04-24T20:00:00Z,110516376,False,3180023,126582,14:21,I Got Hunted By A Real Bounty Hunter
WcwGleN38zE,,,,,,,,,,,Extreme 100000 Game of Tag,2021-04-17T20:00:00Z,115338148,False,2723891,119369,16:54,Extreme 100000 Game of Tag
fMfipiV_17o,,,,,,,,,,,Would You Sit In Snakes For 10000,2021-04-10T21:00:07Z,170253937,False,4048827,139383,14:9,Would You Sit In Snakes For 10000
ayXxwJJId_c,,,,,,,,,,,I Bought The Worlds Largest Mystery Box 500000,2021-04-03T20:00:01Z,144765686,False,3738098,170617,11:49,I Bought The Worlds Largest Mystery Box 500000
9bqk6ZUsKyA,,,,,,,,,,,I Spent 50 Hours Buried Alive,2021-03-27T20:00:04Z,200862574,False,6259690,240313,12:40,I Spent 50 Hours Buried Alive
DuQbOQwVaNE,,,,,,,,,,,Offering People 100000 To Quit Their Job,2021-03-13T21:00:02Z,98247959,False,2928467,119297,10:27,Offering People 100000 To Quit Their Job
vJH28ICkCdU,,,,,,,,,,,I Sold My House For 1,2021-03-06T21:00:02Z,101658167,False,3139251,117431,9:20,I Sold My House For 1
_uwNDiU04zE,,,,,,,,,,,If You Press This Ill Pay,2021-02-13T21:00:01Z,46895925,False,2777972,152564,11:5,If You Press This Ill Pay
C680oxL__ck,,,,,,,,,,,I Ate 100000 Golden Ice Cream,2021-01-22T21:00:03Z,139704989,False,4147482,168419,13:17,I Ate 100000 Golden Ice Cream
5Fg9oZk-5uA,,,,,,,,,,,I Bought Everything In 5 Stores,2021-01-09T21:01:25Z,97445362,False,4098847,189245,14:14,I Bought Everything In 5 Stores
PKtnafFtfEo,,,,,,,,,,,Youtube Rewind 2020 Thank God Its Over,2021-01-01T21:00:03Z,62238390,False,4861102,291431,6:31,Youtube Rewind 2020 Thank God Its Over
f0c7pSCoZqE,,,,,,,,,,,I Put 1000000 Christmas Lights On A House World Record,2020-12-23T21:00:06Z,65165156,False,2335188,109555,11:22,I Put 1000000 Christmas Lights On A House World Record
dg2Ag3e8W-Q,,,,,,,,,,,I Opened A Restaurant That Pays You To Eat At It,2020-12-19T22:00:03Z,121766778,False,4056572,728539,10:47,I Opened A Restaurant That Pays You To Eat At It
LeYsRMZFUq0,,,,,,,,,,,I Gave People 1000000 But ONLY 1 Minute To Spend It,2020-12-15T21:00:11Z,119180150,False,5040267,176863,14:20,I Gave People 1000000 But ONLY 1 Minute To Spend It
Dc2ZRmuH5OM,,,,,,,,,,,Steal This 100000 Diamond You Keep It,2020-11-28T21:00:04Z,131365187,False,2881295,95328,14:3,Steal This 100000 Diamond You Keep It
GLoeAJUcz38,,,,,,,,,,,Press This Button To Win 100000,2020-11-14T21:00:02Z,194909135,False,3310697,89700,15:11,Press This Button To Win 100000
SZQhgExjBvQ,,,,,,,,,,,I Survived 24 Hours Straight In Ice,2020-10-29T20:17:44Z,105110356,False,3184960,190651,11:34,I Survived 24 Hours Straight In Ice
IoZri9hq7z4,,,,,,,,,,,I Uberd People And Let Them Keep The Car,2020-10-24T20:00:01Z,80037458,False,2934568,84061,14:11,I Uberd People And Let Them Keep The Car
1V_03efSkg0,,,,,,,,,,,300000 Influencer Trivia Tournament,2020-10-18T00:19:57Z,55960420,False,2128387,118181,24:5,300000 Influencer Trivia Tournament
vp5sSqyZ5Go,,,,,,,,,,,I Filled My Brothers House With Slime Bought Him A New One,2020-10-10T20:00:31Z,121185747,False,3013978,117999,10:25,I Filled My Brothers House With Slime Bought Him A New One
AKJfakEsgy0,,,,,,,,,,,Hi Me In 5 Years,2020-10-04T20:00:54Z,71889566,False,4717596,211539,2:8,Hi Me In 5 Years
In0dAUxq_Lk,,,,,,,,,,,Diana and Roma celebrate Romas 10th Birthday Party Lets Play style,2022-11-01T13:36:04Z,742624,True,3903,0,6:56,Diana and Roma celebrate Romas 10th Birthday Party Lets Play style
zQnBbWmEbZY,,,,,,,,,,,Diana and Roma Trick or Treat Halloween Adventure,2022-10-28T12:04:02Z,3617609,True,16209,0,7:21,Diana and Roma Trick or Treat Halloween Adventure
WjCdHx1kPAw,,,,,,,,,,,Diana and Roma Magic Colored playhouse challenge,2022-10-23T06:03:16Z,4928117,True,23330,0,4:33,Diana and Roma Magic Colored playhouse challenge
yj2lH42rnug,,,,,,,,,,,Diana and Roma visit Hobbledown Adventure Park,2022-10-20T07:13:10Z,2439750,True,8984,0,2:55,Diana and Roma visit Hobbledown Adventure Park
HpSYYIehAtw,,,,,,,,,,,Diana and Roma kids stories about Halloween,2022-10-16T07:25:55Z,2774680,True,17612,0,26:23,Diana and Roma kids stories about Halloween
BCiqD9Vrg1E,,,,,,,,,,,Diana and Roma play in Four Colors Playhouse,2022-10-13T12:04:17Z,8476793,True,30723,0,5:17,Diana and Roma play in Four Colors Playhouse
ltmt4s8oblE,,,,,,,,,,,Diana and Roma 24 hours in the Baby Room Challenge,2022-10-09T07:18:55Z,6322902,True,19704,0,3:40,Diana and Roma 24 hours in the Baby Room Challenge
XjRI6sb6Sz0,,,,,,,,,,,Diana and the most interesting moments of summer vacation,2022-10-02T07:01:42Z,4384791,True,17213,0,34:29,Diana and the most interesting moments of summer vacation
