video_id,channel_id,title,description,publishedAt,categoryId,viewCount,likeCount,dislikeCount,commentCount,topicId,video_title,published,video_views,video_madeforkids,video_likes,video_comment_count,video_length,video_title_clean
oZOU306yv2g,,,,,,,,,,,Justin Bieber Peaches Remix ft Ludacris Usher Snoop Dogg,2021-06-07T04:00:05Z,7368123,False,292800,17310,3:50,Justin Bieber Peaches Remix ft Ludacris Usher Snoop Dogg
ea9ExLiqczk,,,,,,,,,,,Justin Bieber Peaches Hold On Live On The Voice 2021,2021-05-27T17:33:27Z,7680721,False,227391,9635,4:22,Justin Bieber Peaches Hold On Live On The Voice 2021
4FDmH922dDA,,,,,,,,,,,Justin Bieber Unstable Live from Paris,2021-04-13T23:36:16Z,7836637,False,178985,6110,2:26,Justin Bieber Unstable Live from Paris
p1ZNAHZGGhw,,,,,,,,,,,We Are All Different What Does the Animal Look Like  Farm Animals Songs Pinkfong Kids Songs,2022-11-02T23:00:18Z,3230,True,33,0,3:,We Are All Different What Does the Animal Look Like  Farm Animals Songs Pinkfong Kids Songs
HIGcFrWMNdc,,,,,,,,,,,Pinkfongs got new glasses shorts,2022-11-02T12:00:13Z,148416,True,0,0,11,Pinkfongs got new glasses shorts
1qORX_YbyDw,,,,,,,,,,,Day of the Dead and more Compilation Halloween Songs Pinkfong Songs for Children,2022-11-01T23:00:01Z,95719,True,468,0,1:41,Day of the Dead and more Compilation Halloween Songs Pinkfong Songs for Children
NShOi02d_W4,,,,,,,,,,,Pinkfong Shapes Colors App Match Ice Creams Teddy Bear Game Play for Kids Baby Shark Games,2022-11-01T12:00:12Z,23346,True,0,0,30,Pinkfong Shapes Colors App Match Ice Creams Teddy Bear Game Play for Kids Baby Shark Games
gDEbXJWEESI,,,,,,,,,,,Lets Make Fruit Jello Together Pinkfongs Snack Time Cook with Pinkfong Pinkfong Baby Shark,2022-10-31T23:00:31Z,32776,True,209,0,10:51,Lets Make Fruit Jello Together Pinkfongs Snack Time Cook with Pinkfong Pinkfong Baby Shark
gX3YT_aefcA,,,,,,,,,,, Halloween Zombie Sharks are Here Happy Halloween doo doo doo doo doo Pinkfong Baby Shark,2022-10-30T23:00:31Z,248674,True,988,0,1:47:13, Halloween Zombie Sharks are Here Happy Halloween doo doo doo doo doo Pinkfong Baby Shark
oBeQvxFbJpI,,,,,,,,,,,Chumbala Cachumbala Halloween Zombie Sharks and more  Songs Stories Pinkfong Baby shark,2022-10-30T12:00:25Z,257327,True,794,0,1:48:55,Chumbala Cachumbala Halloween Zombie Sharks and more  Songs Stories Pinkfong Baby shark
liIEB8qUjTY,,,,,,,,,,,Baby Shark Pumpkin Drummin shorts halloween,2022-10-30T10:00:35Z,373128,True,0,0,12,Baby Shark Pumpkin Drummin shorts halloween
16Yf6DWjeyI,,,,,,,,,,,Scary Spooky Sea Monsters Follow Baby Shark Family Halloween Songs Pinkfong Baby Shark,2022-10-29T23:00:01Z,292323,True,1035,0,1:3:9,Scary Spooky Sea Monsters Follow Baby Shark Family Halloween Songs Pinkfong Baby Shark
aPcT0cYIr4M,,,,,,,,,,,Baby Car vroom vroom on a Halloween Slide shorts,2022-10-29T12:00:02Z,522247,True,0,0,11,Baby Car vroom vroom on a Halloween Slide shorts
xBtLGfKwgjc,,,,,,,,,,,Welcome to Baby Sharks Scary Face Contest Compilation Halloween Songs Pinkfong Baby Shark,2022-10-28T23:00:22Z,186392,True,767,0,49:1,Welcome to Baby Sharks Scary Face Contest Compilation Halloween Songs Pinkfong Baby Shark
M42UzE-SBhQ,,,,,,,,,,,Witch Sharks Halloween Treats Doo Doo Doo,2022-10-28T12:00:30Z,381888,True,0,0,16,Witch Sharks Halloween Treats Doo Doo Doo
ESbCSW9lBVw,,,,,,,,,,,Baby Shark Babysits little Baby Shark on a Halloween Night Peekaboo Pinkfong Story for Kids,2022-10-27T23:00:05Z,297107,True,1151,0,1:39:32,Baby Shark Babysits little Baby Shark on a Halloween Night Peekaboo Pinkfong Story for Kids
UsN_rhHh2S0,,,,,,,,,,,The Mummy Goes roundandround shorts,2022-10-27T12:00:31Z,293546,True,0,0,22,The Mummy Goes roundandround shorts
Vx9NYVz6uME,,,,,,,,,,,Zombie Shark Family Hide and Seek Mommy Shark Turned into a Zombie Pinkfong Baby Shark,2022-10-26T23:00:23Z,489974,True,1974,0,10:19,Zombie Shark Family Hide and Seek Mommy Shark Turned into a Zombie Pinkfong Baby Shark
ARnZqnhHMB8,,,,,,,,,,,Halloween Baby Shark Coloring Book,2022-10-26T12:00:08Z,390262,True,0,0,1:,Halloween Baby Shark Coloring Book
a5FZ0ya39xs,,,,,,,,,,,LIVE Happy Halloween Songs Cartoons for Kids Baby Shark Songs and more  Pinkfong,2022-10-26T11:03:19Z,1436018,True,0,0,P0D,LIVE Happy Halloween Songs Cartoons for Kids Baby Shark Songs and more  Pinkfong
qdT25kDURbo,,,,,,,,,,, Special Halloween Stories Cartoons Hospital Play and More Compilation Pinkfong Baby Shark,2022-10-25T23:00:22Z,971788,True,1512,0,1:58:40, Special Halloween Stories Cartoons Hospital Play and More Compilation Pinkfong Baby Shark
wK_RGay77uU,,,,,,,,,,,Knock Knock Trick or Treat Give me some candies shorts,2022-10-25T12:00:47Z,402154,True,0,0,15,Knock Knock Trick or Treat Give me some candies shorts
-1Wl9JGZwP4,,,,,,,,,,,Roar Scary Predator Friends Go to Hospital Baby Sharks Hospital Play Pinkfong Baby Shark,2022-10-24T23:00:00Z,2029125,True,3462,0,9:2,Roar Scary Predator Friends Go to Hospital Baby Sharks Hospital Play Pinkfong Baby Shark
sH8DhhaCFHg,,,,,,,,,,,Grandma car vroom vroom on a Halloween Slide shorts,2022-10-24T12:00:41Z,574538,True,0,0,11,Grandma car vroom vroom on a Halloween Slide shorts
-FM3QeHGCV0,,,,,,,,,,,Baby Shark Halloween Slide and more Halloween for Kids Pinkfong Baby Shark,2022-10-23T23:00:00Z,313475,True,1098,0,1:2:,Baby Shark Halloween Slide and more Halloween for Kids Pinkfong Baby Shark
qy0BcRqSxEw,,,,,,,,,,,The Flying Pumpkin and Pinkfong shorts,2022-10-23T12:00:42Z,1098862,True,0,0,14,The Flying Pumpkin and Pinkfong shorts
KEvmwEUeA_w,,,,,,,,,,,Wheels on the Halloween Bus and more Compilation Halloween Songs Pinkfong Baby Shark,2022-10-22T23:00:08Z,195422,True,722,0,27:46,Wheels on the Halloween Bus and more Compilation Halloween Songs Pinkfong Baby Shark
2CCjw57xivs,,,,,,,,,,,Pinkfongs Scary Halloween VLOG shorts,2022-10-22T12:00:02Z,865767,True,0,0,11,Pinkfongs Scary Halloween VLOG shorts
QT0x8KGQgvs,,,,,,,,,,,How to Make Baby Sharks Magic Halloween Potion Halloween Story for Kids Pinkfong Baby Shark,2022-10-21T23:00:12Z,296451,True,1023,0,10:18,How to Make Baby Sharks Magic Halloween Potion Halloween Story for Kids Pinkfong Baby Shark
48I_cQCjBCk,,,,,,,,,,,Pinkfong and Baby Shark to Join NewJeans Looking for Attention Pinkfong Dance Alive,2022-10-21T10:00:10Z,221678,True,2591,0,7:38,Pinkfong and Baby Shark to Join NewJeans Looking for Attention Pinkfong Dance Alive
Z4_4X9Rjq8w,,,,,,,,,,, Ninimo Song shorts,2022-10-20T23:00:12Z,748916,True,0,0,9, Ninimo Song shorts
4ks6ITaoQFA,,,,,,,,,,,I Hate Cucumbers Song Ninimo Song Fun Cucumber Cat Song Pinkfong Baby Shark,2022-10-20T12:00:07Z,152203,True,492,0,2:7,I Hate Cucumbers Song Ninimo Song Fun Cucumber Cat Song Pinkfong Baby Shark
qfWme0_xlhs,,,,,,,,,,,Cube Baby Shark Dance and more Compilation Sing Along with Baby Shark Pinkfong Songs,2022-10-19T23:00:20Z,1114674,True,2315,0,1:2:22,Cube Baby Shark Dance and more Compilation Sing Along with Baby Shark Pinkfong Songs
f--qFQ71KuI,,,,,,,,,,,Help Baby Shark find his Halloween Items Baby Shark Zigsaw Puzzle Fun,2022-10-19T12:00:35Z,141956,True,0,0,1:1,Help Baby Shark find his Halloween Items Baby Shark Zigsaw Puzzle Fun
dO0w78UHXXQ,,,,,,,,,,,Witch Sharks Doo Doo Doo and more  Halloween Songs for Kids Compilation Pinkfong Baby Shark,2022-10-18T23:00:23Z,732056,True,1799,0,53:10,Witch Sharks Doo Doo Doo and more  Halloween Songs for Kids Compilation Pinkfong Baby Shark
-LmTDQnUZhY,,,,,,,,,,,Halloween Baby Shark Doo doo doo shorts,2022-10-18T12:00:00Z,1340490,True,0,0,29,Halloween Baby Shark Doo doo doo shorts
dHaHrEctlDU,,,,,,,,,,,Spooky Halloween Monsters Go to Hospital Baby Sharks Hospital Play Pinkfong Baby Shark,2022-10-17T23:00:13Z,4643117,True,15629,0,9:19,Spooky Halloween Monsters Go to Hospital Baby Sharks Hospital Play Pinkfong Baby Shark
tZI-nJAEUyE,,,,,,,,,,,App Trailer Baby Shark Makeover Game,2022-10-17T12:00:38Z,128411,True,0,0,43,App Trailer Baby Shark Makeover Game
nuE5SdIgySk,,,,,,,,,,,4K Witch Sharks Halloween Treats Halloween Dance Pinkfong Baby Shark,2022-10-16T23:00:26Z,275352,True,577,0,3:24,4K Witch Sharks Halloween Treats Halloween Dance Pinkfong Baby Shark
3IqvFlq5n0g,,,,,,,,,,,BEST Halloween Compilation for Kids Chumbala Sharks Cars Pinkfong Baby Shark Halloween,2022-10-16T12:00:02Z,426926,True,1018,0,1:11:20,BEST Halloween Compilation for Kids Chumbala Sharks Cars Pinkfong Baby Shark Halloween
kDUye0eu4tY,,,,,,,,,,,Hype Boy Dance Cover by Pinkfong shorts NewJeans,2022-10-16T10:00:34Z,728079,True,0,0,22,Hype Boy Dance Cover by Pinkfong shorts NewJeans
m8IuaBQMA58,,,,,,,,,,, Halloween Freeze Dance shorts,2022-10-15T12:00:27Z,622735,True,0,0,37, Halloween Freeze Dance shorts
hF7irPUVss8,,,,,,,,,,,Witch Sharks Halloween Treats Five Little Halloween Witch Sharks Doo doo Pinkfong Baby Shark,2022-10-14T23:00:16Z,411428,True,614,0,3:24,Witch Sharks Halloween Treats Five Little Halloween Witch Sharks Doo doo Pinkfong Baby Shark
Y4Mf2vln_xk,,,,,,,,,,,Attention Dance Cover by Pinkfong x Baby Shark x NewJeans  KPOP Dance Collab Dance Alive,2022-10-14T10:00:08Z,664039,True,6465,0,3:28,Attention Dance Cover by Pinkfong x Baby Shark x NewJeans  KPOP Dance Collab Dance Alive
oxDNxOzV-aM,,,,,,,,,,,Baby Sharks Halloween Wheels on the Bus Bus Play Cartoon For Kids Pinkfong Baby Shark,2022-10-13T23:00:21Z,2193596,True,7321,0,9:47,Baby Sharks Halloween Wheels on the Bus Bus Play Cartoon For Kids Pinkfong Baby Shark
2cKFDI4_KKY,,,,,,,,,,,BOO Im a Zombie Halloween Shark Halloween Songs for Kids Pinkfong Baby Shark,2022-10-13T12:00:01Z,382633,True,996,0,1:2:52,BOO Im a Zombie Halloween Shark Halloween Songs for Kids Pinkfong Baby Shark
CFl8gwQ6gaU,,,,,,,,,,,Grandpa car vroom vroom on a Halloween Slide shorts,2022-10-13T10:00:13Z,975192,True,0,0,11,Grandpa car vroom vroom on a Halloween Slide shorts
xcxH40OuF_Q,,,,,,,,,,,Baby Shark goes to the Haunted Halloween Amusement Park Round and Round with Monsters Pinkfong,2022-10-12T23:00:17Z,535992,True,842,0,3:33,Baby Shark goes to the Haunted Halloween Amusement Park Round and Round with Monsters Pinkfong
cN0MAegZ4JM,,,,,,,,,,,Mona Lisa Baby Sharks Eyebrows Are Gone Have You Seen My Twinkling Eyebrows,2022-10-12T03:00:26Z,250733,True,758,0,2:58,Mona Lisa Baby Sharks Eyebrows Are Gone Have You Seen My Twinkling Eyebrows
JPXsYQ4mXAY,,,,,,,,,,,Ninimo Song Dance Cover by NewJeans x Pinkfong x Baby Shark shorts,2022-10-11T12:00:18Z,594630,True,0,0,29,Ninimo Song Dance Cover by NewJeans x Pinkfong x Baby Shark shorts
APyGL-haX2o,,,,,,,,,,,Pinkfongs Ninimo Song Dance with NewJeans  KPOP Dance Collab Pinkfong Dance Alive,2022-10-11T10:00:11Z,1409855,True,12941,0,1:28,Pinkfongs Ninimo Song Dance with NewJeans  KPOP Dance Collab Pinkfong Dance Alive
LPBprPIkEnY,,,,,,,,,,,Baby Shark Halloween Slide Knock Knock Trick or Treat Halloween Costume Pinkfong Colors,2022-10-10T23:00:07Z,1799134,True,1810,0,3:21,Baby Shark Halloween Slide Knock Knock Trick or Treat Halloween Costume Pinkfong Colors
ZYKndrw-y-Q,,,,,,,,,,,Welcome to Halloween Costume Party Halloween Dance Adventure Kids Story Pinkfong Baby Shark,2022-10-09T23:00:16Z,194194,True,524,0,5:36,Welcome to Halloween Costume Party Halloween Dance Adventure Kids Story Pinkfong Baby Shark
hF6X2ap_6Q8,,,,,,,,,,,Gun Game Airsoft Battle,2022-10-22T13:59:55Z,5228436,False,222331,6667,14:15,Gun Game Airsoft Battle
etV_nxVU6l8,,,,,,,,,,,Wedding Stereotypes,2022-10-08T14:00:04Z,8060278,False,289600,12703,11:16,Wedding Stereotypes
oW-ayP9BbHs,,,,,,,,,,,Stair Jump CHALLENGE,2022-10-01T18:37:03Z,10504581,False,735336,2416,56,Stair Jump CHALLENGE
_snnKw-EywM,,,,,,,,,,,Archery World Records,2022-09-24T14:00:51Z,6898673,False,196974,5271,7:51,Archery World Records
DK0xCH--t8k,,,,,,,,,,,Loser Gets Full Body Casted OT 35,2022-09-10T14:00:11Z,7890365,False,238280,7111,21:3,Loser Gets Full Body Casted OT 35
ehPugxlo_oY,,,,,,,,,,,Ultimate Mini Games Battle 2,2022-08-27T13:59:56Z,12141086,False,237491,5801,12:23,Ultimate Mini Games Battle 2
_YUc8tXDjxQ,,,,,,,,,,,Worlds Longest Trick Shot Machine,2022-08-13T14:00:59Z,7191666,False,235494,10182,10:22,Worlds Longest Trick Shot Machine
4oe-Cy_dIQk,,,,,,,,,,,Dude Perfect EXPOSED ,2022-08-06T13:45:22Z,27750592,False,1404518,12844,17,Dude Perfect EXPOSED 
jcwaXQ2tGl8,,,,,,,,,,,It Just Keeps Getting Better ,2022-08-02T20:33:50Z,28636016,False,1179249,3101,28,It Just Keeps Getting Better 
TJc4HjMBpSM,,,,,,,,,,,Impossible Ping Pong Vase Challenge,2022-07-21T20:30:28Z,14179803,False,951935,2411,1:,Impossible Ping Pong Vase Challenge
fIgysTSIXfE,,,,,,,,,,,Bucket List Desert,2022-07-16T14:00:00Z,7179466,False,238160,17434,16:9,Bucket List Desert
venrE8gdz30,,,,,,,,,,,Model Rocket Battle 3 Dude Perfect,2022-07-02T14:00:12Z,20780705,False,557756,16099,10:38,Model Rocket Battle 3 Dude Perfect
s1tEvufgEyU,,,,,,,,,,,Real Life Invisibility Shield OT34,2022-06-18T14:00:02Z,10729502,False,293909,11001,15:24,Real Life Invisibility Shield OT34
IlhYyVRklDI,,,,,,,,,,,That Ball Touched The CLOUDS shorts,2022-06-15T21:58:37Z,154752078,False,5786295,29154,42,That Ball Touched The CLOUDS shorts
7VzDrqjhcXs,,,,,,,,,,,RC Edition 2 Dude Perfect,2022-06-04T14:00:09Z,11009778,False,434126,7556,8:27,RC Edition 2 Dude Perfect
_CH8uu3L4D0,,,,,,,,,,,New Parent Stereotypes,2022-05-14T13:59:57Z,19611103,False,408836,11329,10:49,New Parent Stereotypes
pQuk3t2aeBo,,,,,,,,,,,Treasure Hunting Battle Crystals,2022-04-30T13:59:59Z,13218616,False,340512,7013,10:54,Treasure Hunting Battle Crystals
gmuAN_n3_tY,,,,,,,,,,,Water Balloon Roulette ,2022-04-27T21:59:35Z,8731425,False,410889,1281,55,Water Balloon Roulette 
DZcRaZ-nDeA,,,,,,,,,,,Ultimate Mini Games Battle,2022-04-16T14:00:06Z,27779912,False,385528,5455,9:34,Ultimate Mini Games Battle
heIKaaamvdc,,,,,,,,,,,All Sports Golf Battle at The Masters,2022-04-02T13:59:57Z,11926856,False,363209,6981,11:18,All Sports Golf Battle at The Masters
GsLopdvhFpk,,,,,,,,,,,Unpredictable Trick Shots 2,2022-03-19T14:00:00Z,19216097,False,482730,7503,8:27,Unpredictable Trick Shots 2
UoVNtD-0kTI,,,,,,,,,,,Airplane Stereotypes,2022-03-05T15:00:10Z,27586296,False,578390,14809,9:44,Airplane Stereotypes
LDKDyn_D9pQ,,,,,,,,,,,Cup Trick Shots Dude Perfect,2022-02-19T14:59:58Z,10245078,False,467205,12006,4:51,Cup Trick Shots Dude Perfect
CYdSF0tND4A,,,,,,,,,,,Cup Throwing Trick Shots are HARD Shorts,2022-02-09T22:56:11Z,14294887,False,602486,1601,23,Cup Throwing Trick Shots are HARD Shorts
Xixpb9qEDw0,,,,,,,,,,,Worlds Longest TShirt Launch OT 33,2022-02-07T23:05:07Z,12551397,False,305405,25105,19:41,Worlds Longest TShirt Launch OT 33
3QwpRXR-IUc,,,,,,,,,,,Snow Sniper Airsoft Battle,2022-01-24T22:59:55Z,16783855,False,495587,8763,10:1,Snow Sniper Airsoft Battle
4qjZH9T8jlE,,,,,,,,,,,Candle Blowing Challenge is INTENSE ,2022-01-13T19:16:53Z,68481789,False,4674697,3052,51,Candle Blowing Challenge is INTENSE 
YJljg4t-LGI,,,,,,,,,,,Exploding Christmas Presents OT 32,2021-12-20T22:59:58Z,10100596,False,267611,9120,15:33,Exploding Christmas Presents OT 32
6fBqGUaJ0tc,,,,,,,,,,,Whoever DESTROYS THEIR CAR MOST Wins OT 31,2021-12-06T23:00:30Z,15721788,False,344648,27771,19:59,Whoever DESTROYS THEIR CAR MOST Wins OT 31
hj5Xv2L2X4M,,,,,,,,,,,Alaska Bucket List,2021-11-22T22:59:51Z,20240731,False,500947,14868,33:7,Alaska Bucket List
mt81k1z4VIw,,,,,,,,,,,Boomerang Trick Shots 2 Dude Perfect,2021-11-08T22:59:59Z,10358924,False,326435,5737,7:46,Boomerang Trick Shots 2 Dude Perfect
8XUDSIxQRU4,,,,,,,,,,,Build A Raft Battle,2021-10-25T21:59:58Z,16196598,False,432905,26437,13:28,Build A Raft Battle
Flj-KI9fOoM,,,,,,,,,,,Worlds Smallest TV OT 30,2021-10-11T22:00:00Z,13186706,False,327007,9672,19:42,Worlds Smallest TV OT 30
t8JCJZM8tCw,,,,,,,,,,,Optical Illusion Trick Shots ft Zach King,2021-09-27T22:00:49Z,21954512,False,647818,9377,8:3,Optical Illusion Trick Shots ft Zach King
rzi_iXUTuXY,,,,,,,,,,,Top 5 Vehicles Bucket List,2021-09-13T21:58:19Z,16394429,False,468035,13956,18:12,Top 5 Vehicles Bucket List
D7f04YOXQq8,,,,,,,,,,,Chainsaw Carving Competition OT 29,2021-08-30T21:59:58Z,16151936,False,380831,82532,22:11,Chainsaw Carving Competition OT 29
BTVMLRSsb3o,,,,,,,,,,,Submarine Minefield Battle,2021-08-23T22:03:23Z,11429267,False,306575,5597,12:44,Submarine Minefield Battle
RL42Yl4LS6c,,,,,,,,,,,Trying to Bench 405 lbs Underwater OT 28,2021-07-26T21:59:56Z,20824828,False,497639,39090,19:46,Trying to Bench 405 lbs Underwater OT 28
y2TPOTlPU9M,,,,,,,,,,,Demolition Derby Battle,2021-07-12T21:59:59Z,15312646,False,467397,11124,13:10,Demolition Derby Battle
2EGuVKx_MXA,,,,,,,,,,,Cell Phone Stereotypes,2021-06-28T22:00:08Z,33301984,False,688899,25493,12:43,Cell Phone Stereotypes
Tl1ycnEFk3I,,,,,,,,,,,Worlds Hottest Hot Sauce OT 27,2021-06-14T22:00:04Z,22680814,False,508702,22910,24:32,Worlds Hottest Hot Sauce OT 27
Df_hrHHcQ_g,,,,,,,,,,,Fastest Soapbox Car Wins,2021-05-31T21:59:56Z,24107582,False,613258,16800,11:57,Fastest Soapbox Car Wins
I4AgeDIrHGY,,,,,,,,,,,South Africa Bucket List,2021-05-17T21:59:59Z,29739813,False,789091,39124,31:39,South Africa Bucket List
_eIH4F-24M4,,,,,,,,,,,Pet Peeves Official Music Video,2021-05-03T21:59:59Z,14712066,False,486516,32070,3:30,Pet Peeves Official Music Video
PAgQHcKMOIk,,,,,,,,,,,Worlds Weirdest Item OT 26,2021-04-19T22:00:23Z,24161084,False,533400,24815,26:18,Worlds Weirdest Item OT 26
Z8y05MbYm1Q,,,,,,,,,,,RC Helicopter Battle Dude Perfect,2021-04-05T22:00:09Z,14306262,False,411815,9144,10:11,RC Helicopter Battle Dude Perfect
8Mc6zZxBTLA,,,,,,,,,,,OUR WIVES JOIN THE SHOW OT 25,2021-03-22T22:00:19Z,19432832,False,445712,37458,25:46,OUR WIVES JOIN THE SHOW OT 25
qUUloBe5vEo,,,,,,,,,,,Longest Dunk Wins,2021-03-08T23:00:02Z,67984659,False,1069656,21000,10:19,Longest Dunk Wins
n1dEqq2hepw,,,,,,,,,,,Dude Wars OT 24,2021-02-22T23:10:14Z,28601962,False,548405,30275,25:56,Dude Wars OT 24
cfZA6udrVUc,,,,,,,,,,,Toy Trick Shots Dude Perfect,2021-02-08T23:00:52Z,23448719,False,630806,19090,4:57,Toy Trick Shots Dude Perfect
5ksrBbLdIy4,,,,,,,,,,,Marry Me 2022 Marry Me Again Scene Movieclips,2022-11-02T18:45:00Z,4657,False,46,3,1:53,Marry Me 2022 Marry Me Again Scene Movieclips
tGxVMfURIRk,,,,,,,,,,,Marry Me 2022 Are You Breaking up With Me Scene Movieclips,2022-11-02T18:30:47Z,1369,False,24,2,2:53,Marry Me 2022 Are You Breaking up With Me Scene Movieclips
kGKNxWD3LU4,,,,,,,,,,,Marry Me 2022 On My Way Scene Movieclips,2022-11-02T17:45:02Z,2325,False,32,5,3:9,Marry Me 2022 On My Way Scene Movieclips
_CIMWDhgSWc,,,,,,,,,,,Marry Me 2022 Marry Me Scene Movieclips,2022-11-02T17:15:01Z,2043,False,23,1,3:23,Marry Me 2022 Marry Me Scene Movieclips
FSF7-OFPBx8,,,,,,,,,,,Marry Me 2022 I Got My Wish Scene Movieclips,2022-11-02T17:00:16Z,18261,False,452,30,1:57,Marry Me 2022 I Got My Wish Scene Movieclips
db1GpTnStRo,,,,,,,,,,,Marry Me 2022 Slow Dancing Together Scene Movieclips,2022-11-02T15:28:01Z,4641,False,44,2,2:52,Marry Me 2022 Slow Dancing Together Scene Movieclips
0FcI8KuetDE,,,,,,,,,,,Marry Me 2022 After Love Scene Movieclips,2022-11-02T15:27:48Z,3316,False,35,6,2:51,Marry Me 2022 After Love Scene Movieclips
f61kIAmnW5k,,,,,,,,,,,Marry Me 2022 The Mathletes Dance Scene Movieclips,2022-11-02T15:27:37Z,812,False,18,3,1:41,Marry Me 2022 The Mathletes Dance Scene Movieclips
Jm66XgGRKBs,,,,,,,,,,,Marry Me 2022 Pop Concert Wedding Scene Movieclips,2022-11-02T15:27:25Z,1279,False,35,4,3:5,Marry Me 2022 Pop Concert Wedding Scene Movieclips
7kCU4WrmhX4,,,,,,,,,,,Marry Me 2022 Church Scene Movieclips,2022-11-02T15:27:14Z,30308,False,620,106,2:11,Marry Me 2022 Church Scene Movieclips
1vhqWKtlwQI,,,,,,,,,,,Redeeming Love 2022 Husband Wife at Last Scene Movieclips,2022-11-01T21:15:00Z,31003,False,276,12,3:40,Redeeming Love 2022 Husband Wife at Last Scene Movieclips
f2A5LowZJOE,,,,,,,,,,,Redeeming Love 2022 Rescuing Little Girls Scene Movieclips,2022-11-01T21:00:30Z,4162,False,45,1,1:52,Redeeming Love 2022 Rescuing Little Girls Scene Movieclips
TTx8wXmX7IU,,,,,,,,,,,Redeeming Love 2022 God I Want to Believe Scene Movieclips,2022-11-01T20:45:00Z,4879,False,45,4,3:16,Redeeming Love 2022 God I Want to Believe Scene Movieclips
_ibi-oUilH8,,,,,,,,,,,Redeeming Love 2022 Saying Goodbye Scene Movieclips,2022-11-01T20:30:03Z,15963,False,103,4,2:59,Redeeming Love 2022 Saying Goodbye Scene Movieclips
Bl3F5L2Oatg,,,,,,,,,,,Redeeming Love 2022 Singing by the Fire Scene Movieclips,2022-11-01T20:15:00Z,2087,False,39,3,2:37,Redeeming Love 2022 Singing by the Fire Scene Movieclips
m6Rw44zVXVQ,,,,,,,,,,,Redeeming Love 2022 Fighting for His Wife Scene Movieclips,2022-11-01T20:00:30Z,21030,False,388,28,2:20,Redeeming Love 2022 Fighting for His Wife Scene Movieclips
wwFv4vuocdk,,,,,,,,,,,Redeeming Love 2022 Their First Time Together Scene Movieclips,2022-11-01T15:54:26Z,35341,False,195,6,2:30,Redeeming Love 2022 Their First Time Together Scene Movieclips
H12k5WtQjUo,,,,,,,,,,,Redeeming Love 2022 Falling in Love Scene Movieclips,2022-11-01T15:54:13Z,12476,False,101,4,3:27,Redeeming Love 2022 Falling in Love Scene Movieclips
-n91Xpiq4kI,,,,,,,,,,,Redeeming Love 2022 Awkward Marriage Proposal Scene Movieclips,2022-11-01T15:53:58Z,13226,False,116,8,3:24,Redeeming Love 2022 Awkward Marriage Proposal Scene Movieclips
xuHWE9XiRYM,,,,,,,,,,,Redeeming Love 2022 Proposing to a Prostitute Scene Movieclips,2022-11-01T15:53:47Z,116636,False,1582,139,3:27,Redeeming Love 2022 Proposing to a Prostitute Scene Movieclips
rxixH40LdC4,,,,,,,,,,,The Best 2000s Horror Movies Countdown,2022-11-01T01:33:23Z,36529,False,659,44,23:55,The Best 2000s Horror Movies Countdown
7anMsX3JiHw,,,,,,,,,,,Morbius 2022 Vampire Bat Swarm Scene Movieclips,2022-10-31T15:50:54Z,15358,False,130,27,2:18,Morbius 2022 Vampire Bat Swarm Scene Movieclips
7G1xgil3d80,,,,,,,,,,,Morbius 2022 Morbius vs Milo Scene Movieclips,2022-10-31T15:50:44Z,8695,False,122,23,2:12,Morbius 2022 Morbius vs Milo Scene Movieclips
n2ObYZqO_zo,,,,,,,,,,,Morbius 2022 A Vampires Kiss Scene Movieclips,2022-10-31T15:50:31Z,15635,False,160,31,2:54,Morbius 2022 A Vampires Kiss Scene Movieclips
s-3fz7yhdaY,,,,,,,,,,,Morbius 2022 Milo Dances Scene Movieclips,2022-10-31T15:50:19Z,27346,False,712,145,2:49,Morbius 2022 Milo Dances Scene Movieclips
hrjhJ43Iric,,,,,,,,,,,Morbius 2022 Morbius Bullies Drug Dealers Scene Movieclips,2022-10-31T15:50:03Z,3265,False,80,14,1:54,Morbius 2022 Morbius Bullies Drug Dealers Scene Movieclips
b95IAjcripE,,,,,,,,,,,Morbius 2022 Flying Through the Subway Scene Movieclips,2022-10-31T15:49:51Z,1730,False,55,7,1:44,Morbius 2022 Flying Through the Subway Scene Movieclips
g2c7HThgTfc,,,,,,,,,,,Morbius 2022 Subway Fight Scene Movieclips,2022-10-31T15:49:41Z,4122,False,86,11,1:29,Morbius 2022 Subway Fight Scene Movieclips
686jgVnwh5M,,,,,,,,,,,Morbius 2022 Breaking out of Prison Scene Movieclips,2022-10-31T15:49:29Z,5190,False,99,13,2:43,Morbius 2022 Breaking out of Prison Scene Movieclips
5oUl6HlSW-Q,,,,,,,,,,,Morbius 2022 Morbius Gets Arrested Scene Movieclips,2022-10-31T15:49:17Z,3254,False,74,9,1:24,Morbius 2022 Morbius Gets Arrested Scene Movieclips
sCwrNlEUv6Y,,,,,,,,,,,Morbius 2022 Morbius vs Mercenaries Scene Movieclips,2022-10-31T15:49:06Z,17612,False,385,95,3:3,Morbius 2022 Morbius vs Mercenaries Scene Movieclips
_gtlQMxFgRQ,,,,,,,,,,,Resident Evil Retribution 2012 Alice vs Rain Scene Movieclips,2022-10-28T21:00:20Z,84698,False,865,138,3:18,Resident Evil Retribution 2012 Alice vs Rain Scene Movieclips
jHLmKs8N6yU,,,,,,,,,,,Resident Evil Retribution 2012 Alice Frees Jill Scene Movieclips,2022-10-28T20:45:01Z,8937,False,130,13,2:32,Resident Evil Retribution 2012 Alice Frees Jill Scene Movieclips
ldOg0GzsEDg,,,,,,,,,,,Resident Evil Retribution 2012 Jill vs Alice Scene Movieclips,2022-10-28T20:30:11Z,10770,False,135,13,3:41,Resident Evil Retribution 2012 Jill vs Alice Scene Movieclips
G3SBhxBg2Hc,,,,,,,,,,,Resident Evil Retribution 2012 Destroying Umbrellas Facility Scene Movieclips,2022-10-28T20:15:01Z,10351,False,158,21,2:44,Resident Evil Retribution 2012 Destroying Umbrellas Facility Scene Movieclips
dq25meTxElg,,,,,,,,,,,Resident Evil Retribution 2012 The Giant Licker Scene Movieclips,2022-10-28T20:00:19Z,29406,False,602,120,3:53,Resident Evil Retribution 2012 The Giant Licker Scene Movieclips
1OqURqnxrMA,,,,,,,,,,,Resident Evil Retribution 2012 Neighborhood Shootout Scene Movieclips,2022-10-28T15:46:16Z,17075,False,234,33,2:37,Resident Evil Retribution 2012 Neighborhood Shootout Scene Movieclips
gM8eTqlN8RQ,,,,,,,,,,,Resident Evil Retribution 2012 Ada Alice vs Executioners Scene Movieclips,2022-10-28T15:46:06Z,5832,False,133,22,2:45,Resident Evil Retribution 2012 Ada Alice vs Executioners Scene Movieclips
XAP8gwPXFcg,,,,,,,,,,,Resident Evil Retribution 2012 Alice Fights Zombies Scene Movieclips,2022-10-28T15:45:56Z,8783,False,159,23,2:50,Resident Evil Retribution 2012 Alice Fights Zombies Scene Movieclips
c6ocMIW0tgw,,,,,,,,,,,Resident Evil Retribution 2012 Tentacle Zombie Attack Scene Movieclips,2022-10-28T15:45:43Z,8922,False,136,12,1:56,Resident Evil Retribution 2012 Tentacle Zombie Attack Scene Movieclips
0-94EMbU9d8,,,,,,,,,,,Resident Evil Retribution 2012 Zombie Home Invasion Scene Movieclips,2022-10-28T15:45:31Z,40669,False,611,107,3:10,Resident Evil Retribution 2012 Zombie Home Invasion Scene Movieclips
E5Szb50okB8,,,,,,,,,,,Resident Evil Afterlife 2010 Weskers End Scene Movieclips,2022-10-27T21:00:14Z,14819,False,159,24,1:19,Resident Evil Afterlife 2010 Weskers End Scene Movieclips
Iz8CcMaFNFo,,,,,,,,,,,Resident Evil Afterlife 2010 Alice vs Wesker Scene Movieclips,2022-10-27T20:45:01Z,41083,False,719,75,2:35,Resident Evil Afterlife 2010 Alice vs Wesker Scene Movieclips
8ZEXGUczkiY,,,,,,,,,,,Resident Evil Afterlife 2010 Weskers Zombie Dogs Scene Movieclips,2022-10-27T20:30:00Z,9365,False,191,22,3:6,Resident Evil Afterlife 2010 Weskers Zombie Dogs Scene Movieclips
phh7S1_M52o,,,,,,,,,,,Resident Evil Afterlife 2010 Alice vs the Executioner Scene Movieclips,2022-10-27T20:15:01Z,8884,False,150,24,3:6,Resident Evil Afterlife 2010 Alice vs the Executioner Scene Movieclips
