video_id,channel_id,title,description,publishedAt,categoryId,viewCount,likeCount,dislikeCount,commentCount,topicId,video_title,published,video_views,video_madeforkids,video_likes,video_comment_count,video_length,video_title_clean
x_uD_Kw7G54,,,,,,,,,,,Lets Learn Dance and Sing with Head Shoulder Knees and Toes Funny Show for Kids,2022-10-17T08:00:22Z,405252,True,0,0,3:6,Lets Learn Dance and Sing with Head Shoulder Knees and Toes Funny Show for Kids
ipozx7pSuLw,,,,,,,,,,,Lets go explore the sea Babys fun time at the beach,2022-10-17T02:13:40Z,0,True,0,0,P0D,Lets go explore the sea Babys fun time at the beach
KqASP1axD4o,,,,,,,,,,,Baby and the Kitten FunPlayBillionSurpriseToys songs Cartoons and Family Playsongs,2022-10-17T02:13:04Z,0,True,0,0,P0D,Baby and the Kitten FunPlayBillionSurpriseToys songs Cartoons and Family Playsongs
iTvgERf6Fzk,,,,,,,,,,,Lets learn to play soccer with Chiya Dolly Johny and Zayy Funny Show for Kids,2022-10-15T08:00:14Z,437036,True,0,0,3:40,Lets learn to play soccer with Chiya Dolly Johny and Zayy Funny Show for Kids
35T7YLphLYI,,,,,,,,,,,Making Pizza with Baby Johny and Family,2022-10-15T00:54:43Z,0,True,0,0,P0D,Making Pizza with Baby Johny and Family
xTqvE_5bogQ,,,,,,,,,,,Luscious ice creams Chiya and the Baby are here for your cravings Funny Show for Kids,2022-10-14T08:00:33Z,360532,True,0,0,3:5,Luscious ice creams Chiya and the Baby are here for your cravings Funny Show for Kids
ANNnvAtaDiE,,,,,,,,,,,Lets go to the park and have some fun,2022-10-14T02:43:31Z,0,True,0,0,P0D,Lets go to the park and have some fun
ZHykPcuYlyE,,,,,,,,,,,Lollipop Song Ice Cream Song More Kids Songs Nursery Rhymes,2022-10-14T02:42:50Z,0,True,0,0,P0D,Lollipop Song Ice Cream Song More Kids Songs Nursery Rhymes
J-D6o5JrnN4,,,,,,,,,,,Cooking with Mommy is so Exited Come Join us,2022-10-14T02:16:33Z,0,True,0,0,P0D,Cooking with Mommy is so Exited Come Join us
TJWOjfp9vxY,,,,,,,,,,,Come Kids Let us Have a Lot of Fun Family Playsongs,2022-10-14T02:16:05Z,0,True,0,0,P0D,Come Kids Let us Have a Lot of Fun Family Playsongs
HrHdYLGhRu8,,,,,,,,,,,Kids Funny Stories at PlaygroundBillionSurpriseToys Cartoon Shows,2022-10-14T01:45:01Z,0,True,0,0,P0D,Kids Funny Stories at PlaygroundBillionSurpriseToys Cartoon Shows
JawBnjzcGRI,,,,,,,,,,,Baby and Mom visit Dentist Fun together and other Funny Stories with Mom,2022-10-14T01:44:37Z,0,True,0,0,P0D,Baby and Mom visit Dentist Fun together and other Funny Stories with Mom
P2ccgOoP30M,,,,,,,,,,,Its a yummy popcorn day But the naughty monkey came to steal it,2022-10-14T01:44:11Z,0,True,0,0,P0D,Its a yummy popcorn day But the naughty monkey came to steal it
p6ZPzfXNR8I,,,,,,,,,,,Meet Johnnys favorite excavator He loves helping everyone with it,2022-10-14T01:43:38Z,0,True,0,0,P0D,Meet Johnnys favorite excavator He loves helping everyone with it
RsxP0vnUmtg,,,,,,,,,,,The ice cream man is here So many delicious flavors Want to try them all,2022-10-14T01:43:29Z,0,True,0,0,P0D,The ice cream man is here So many delicious flavors Want to try them all
aNsOFBoTH5s,,,,,,,,,,,Humpty Zoo Animals Lost Bird Playtime Cartoons and Songs,2022-10-14T01:43:06Z,0,True,0,0,P0D,Humpty Zoo Animals Lost Bird Playtime Cartoons and Songs
TSlcb6kI5Dc,,,,,,,,,,,Kids playtime Ice Cream BillionSurpriseToys Nursery Rhymes Kids Songs,2022-10-14T01:42:36Z,0,True,0,0,P0D,Kids playtime Ice Cream BillionSurpriseToys Nursery Rhymes Kids Songs
Z0Fi9EiuDVk,,,,,,,,,,,Pink vs Black Challenge  New Outdoor Games for kids on a super funday,2022-10-14T01:42:21Z,0,True,0,0,P0D,Pink vs Black Challenge  New Outdoor Games for kids on a super funday
2Gv1mnLG8QQ,,,,,,,,,,,Get ready to have a fun sweet vs spicy food challenge with the siblings,2022-10-14T01:41:50Z,0,True,0,0,P0D,Get ready to have a fun sweet vs spicy food challenge with the siblings
6M8KvwYFrZE,,,,,,,,,,,A camping night to play and explore fun activities Kids Funny Moments,2022-10-14T01:41:23Z,0,True,0,0,P0D,A camping night to play and explore fun activities Kids Funny Moments
JiBrq9vGJZg,,,,,,,,,,,Cooking with Mommy is so Exited Come Join us,2022-10-14T01:40:28Z,0,True,0,0,P0D,Cooking with Mommy is so Exited Come Join us
r9v0O2S5sTE,,,,,,,,,,,Come Kids Let us Have a Lot of Fun Family Playsongs,2022-10-14T01:40:05Z,0,True,0,0,P0D,Come Kids Let us Have a Lot of Fun Family Playsongs
p4wcGfwCMW8,,,,,,,,,,,Finger Family Cartoon and Songs for Kids Five Little Babies and More,2022-10-14T01:14:03Z,0,True,0,0,P0D,Finger Family Cartoon and Songs for Kids Five Little Babies and More
w5OxqNe7Ays,,,,,,,,,,,Outdoor Playground Funny Cartoon Show for Kids BillionSurpriseToys Stories,2022-10-14T01:10:02Z,0,True,0,0,P0D,Outdoor Playground Funny Cartoon Show for Kids BillionSurpriseToys Stories
AlBc606v06U,,,,,,,,,,,Billie Eilish I Didnt Change My Number Apple Music Live 2022,2022-10-01T16:01:01Z,1004527,False,78374,4190,2:37,Billie Eilish I Didnt Change My Number Apple Music Live 2022
UQphbBmXI-E,,,,,,,,,,,Billie Eilish TV Live from the Cloud Forest Singapore,2022-09-21T16:00:31Z,1860825,False,119893,5447,4:25,Billie Eilish TV Live from the Cloud Forest Singapore
WyrZYGmoaFM,,,,,,,,,,,Billie Eilish The 30th Live from the Cloud Forest Singapore,2022-09-21T16:00:18Z,1420609,False,117138,4754,3:28,Billie Eilish The 30th Live from the Cloud Forest Singapore
onT3z0lCZz8,,,,,,,,,,,Billie Eilish The 30th Official Lyric Video,2022-07-21T16:01:55Z,8692127,False,424722,17458,3:37,Billie Eilish The 30th Official Lyric Video
_JGGLJMpVks,,,,,,,,,,,Billie Eilish TV Official Lyric Video,2022-07-21T16:01:50Z,10012179,False,391644,16095,4:42,Billie Eilish TV Official Lyric Video
1TfDbTGTvcg,,,,,,,,,,,Billie Eilish NDA Live at Coachella 2022,2022-04-29T19:31:45Z,2939096,False,164712,6559,3:10,Billie Eilish NDA Live at Coachella 2022
H_hgw-V-wBI,,,,,,,,,,,Billie Eilish Happier Than Ever 64th GRAMMY Awards Performance,2022-04-19T04:25:08Z,17715806,False,597082,13884,5:12,Billie Eilish Happier Than Ever 64th GRAMMY Awards Performance
77UFV6FaDPo,,,,,,,,,,,Billie Eilish FINNEAS No Time To Die Live From The Oscars 2022,2022-03-29T00:48:50Z,7956924,False,380032,11403,4:17,Billie Eilish FINNEAS No Time To Die Live From The Oscars 2022
-1U6jv6SzWY,,,,,,,,,,,Billie Eilish Happier Than Ever The World Tour Road to Opening Night,2022-03-03T17:00:09Z,2050856,False,183844,7620,12:32,Billie Eilish Happier Than Ever The World Tour Road to Opening Night
h6mnfec7bTc,,,,,,,,,,,Billie Eilish Billie Bossa Nova Official Live Performance Vevo,2022-01-13T17:00:22Z,6991010,False,304799,11435,3:22,Billie Eilish Billie Bossa Nova Official Live Performance Vevo
PebrOQm_SZQ,,,,,,,,,,,Billie Eilish Billie Bossa Nova Acoustic,2021-12-20T18:45:40Z,7478013,False,416574,14051,3:,Billie Eilish Billie Bossa Nova Acoustic
XPfW6mGx1SA,,,,,,,,,,,Billie Eilish Happier Than Ever Saturday Night Live2021,2021-12-12T09:34:48Z,6768545,False,373028,9749,5:6,Billie Eilish Happier Than Ever Saturday Night Live2021
afdZ0kbLwt0,,,,,,,,,,,Billie Eilish Male Fantasy Saturday Night Live2021,2021-12-12T09:33:43Z,2036916,False,118860,2705,3:23,Billie Eilish Male Fantasy Saturday Night Live2021
G_BhUxx-cwk,,,,,,,,,,,Billie Eilish Male Fantasy Official Music Video,2021-12-06T17:00:12Z,17562443,False,800461,31985,3:39,Billie Eilish Male Fantasy Official Music Video
vuhYSH36aSM,,,,,,,,,,,Billie Eilish Lost Cause Official Live Performance Vevo,2021-10-21T16:00:34Z,3447901,False,166956,7589,3:34,Billie Eilish Lost Cause Official Live Performance Vevo
_18xpepmbcE,,,,,,,,,,,Billie Eilish Happier Than Ever Track By Track,2021-10-18T20:24:46Z,2675301,False,132955,6533,8:12,Billie Eilish Happier Than Ever Track By Track
6360FasOvdg,,,,,,,,,,,Billie Eilish Happier Than Ever Jimmy Kimmel Live 2021,2021-10-15T05:14:23Z,3798783,False,246169,7877,5:7,Billie Eilish Happier Than Ever Jimmy Kimmel Live 2021
KGK1hseCozI,,,,,,,,,,,Billie Eilish Happier Than Ever Jimmy Kimmel Live2021,2021-10-15T02:13:52Z,108997,False,18003,1114,5:7,Billie Eilish Happier Than Ever Jimmy Kimmel Live2021
Sjw0eGi-FAU,,,,,,,,,,,Billie Eilish No Time To Die Live From Life Is Beautiful 2021,2021-09-28T15:00:30Z,2596914,False,183457,7381,4:,Billie Eilish No Time To Die Live From Life Is Beautiful 2021
ZEkfsSms4Q0,,,,,,,,,,,Billie Eilish Billie Bossa Nova TIME ABC Performance 2021,2021-09-21T06:00:09Z,4948935,False,203365,7094,2:58,Billie Eilish Billie Bossa Nova TIME ABC Performance 2021
INX3MRXG9DM,,,,,,,,,,,Billie Eilish Getting Older TIME ABC Performance 2021,2021-09-21T06:00:03Z,4752820,False,152866,5022,4:21,Billie Eilish Getting Older TIME ABC Performance 2021
b_rn7bwD8qQ,,,,,,,,,,,Billie Eilish Happier Than Ever From Disneys Happier Than Ever A Love Letter To LA,2021-09-10T16:00:31Z,24527728,False,610362,11241,4:56,Billie Eilish Happier Than Ever From Disneys Happier Than Ever A Love Letter To LA
27O942403jM,,,,,,,,,,,Billie Eilish Oxytocin From Disneys Happier Than Ever A Love Letter To LA,2021-08-31T16:00:03Z,6233995,False,300498,11416,4:2,Billie Eilish Oxytocin From Disneys Happier Than Ever A Love Letter To LA
B1q_mxkGUTg,,,,,,,,,,,Happier Than Ever A Love Letter To Los Angeles Official Trailer Billie Eilish on Disney,2021-08-24T16:01:43Z,1594939,False,155564,6207,1:55,Happier Than Ever A Love Letter To Los Angeles Official Trailer Billie Eilish on Disney
hiCICEx3Egk,,,,,,,,,,,Billie Eilish Happier Than Ever in Spatial Audio on Apple Music,2021-08-11T16:00:38Z,1917162,False,155244,5287,1:29,Billie Eilish Happier Than Ever in Spatial Audio on Apple Music
kt-BMjO232I,,,,,,,,,,,Billie Eilish Happier Than Ever Live From The Tonight Show Starring Jimmy Fallon2021,2021-08-10T04:30:08Z,18529351,False,803700,26124,5:2,Billie Eilish Happier Than Ever Live From The Tonight Show Starring Jimmy Fallon2021
pooDUsGR1n4,,,,,,,,,,,Billie Eilish Happier Than Ever Making Of The Video,2021-08-06T16:03:03Z,3140998,False,318472,7875,4:14,Billie Eilish Happier Than Ever Making Of The Video
i7YvaaAkRCw,,,,,,,,,,,Billie Eilish Male Fantasy Official Live Performance Vevo,2021-08-03T22:00:13Z,3976879,False,240786,10756,3:17,Billie Eilish Male Fantasy Official Live Performance Vevo
5GJWxDKyk3A,,,,,,,,,,,Billie Eilish Happier Than Ever Official Music Video,2021-07-30T16:00:09Z,246953555,False,5531893,145139,5:16,Billie Eilish Happier Than Ever Official Music Video
geUYm3f6ZA4,,,,,,,,,,,Billie Eilish Halleys Comet Official Lyric Video,2021-07-30T04:00:27Z,11619198,False,282971,9095,3:55,Billie Eilish Halleys Comet Official Lyric Video
fSr85N64BA0,,,,,,,,,,,Billie Eilish Therefore I Am Official Lyric Video,2021-07-30T04:00:26Z,1579012,False,90826,1812,2:54,Billie Eilish Therefore I Am Official Lyric Video
VseaNKlYXa8,,,,,,,,,,,Billie Eilish NDA Official Lyric Video,2021-07-30T04:00:25Z,2092811,False,93946,2011,3:16,Billie Eilish NDA Official Lyric Video
YEbz2Qt3vec,,,,,,,,,,,Billie Eilish Happier Than Ever Official Lyric Video,2021-07-30T04:00:23Z,48785705,False,768044,22416,4:59,Billie Eilish Happier Than Ever Official Lyric Video
OybFOQyFd4o,,,,,,,,,,,Billie Eilish Lost Cause Official Lyric Video,2021-07-30T04:00:16Z,3470109,False,92863,1669,3:33,Billie Eilish Lost Cause Official Lyric Video
pxxYO7fcFrM,,,,,,,,,,,Billie Eilish Male Fantasy Official Lyric Video,2021-07-30T04:00:15Z,4870085,False,186973,5680,3:15,Billie Eilish Male Fantasy Official Lyric Video
vg6V2UWSjiM,,,,,,,,,,,Billie Eilish OverHeated Official Lyric Video,2021-07-30T04:00:15Z,6137922,False,176829,4710,3:35,Billie Eilish OverHeated Official Lyric Video
OIf8DsfpjC4,,,,,,,,,,,Billie Eilish Not My Responsibility Official Lyric Video,2021-07-30T04:00:09Z,1688579,False,124482,3636,3:48,Billie Eilish Not My Responsibility Official Lyric Video
JpL7scu-EmY,,,,,,,,,,,Billie Eilish GOLDWING Official Lyric Video,2021-07-30T04:00:06Z,5994152,False,178548,5607,2:32,Billie Eilish GOLDWING Official Lyric Video
4tZ969oc-yI,,,,,,,,,,,Billie Eilish Billie Bossa Nova Official Lyric Video,2021-07-30T04:00:05Z,17379411,False,353910,11363,3:17,Billie Eilish Billie Bossa Nova Official Lyric Video
FP-IopSHomc,,,,,,,,,,,Billie Eilish I Didnt Change My Number Official Lyric Video,2021-07-30T04:00:05Z,12490489,False,302392,7807,2:39,Billie Eilish I Didnt Change My Number Official Lyric Video
HfbRVxO7LEE,,,,,,,,,,,Billie Eilish my future Official Lyric Video,2021-07-30T04:00:05Z,872867,False,65804,1648,3:31,Billie Eilish my future Official Lyric Video
BPp4doFEkYE,,,,,,,,,,,Billie Eilish Your Power Official Lyric Video,2021-07-30T04:00:04Z,1424907,False,83913,2905,4:6,Billie Eilish Your Power Official Lyric Video
Fcd8UbutjIg,,,,,,,,,,,Billie Eilish Oxytocin Official Lyric Video,2021-07-30T04:00:04Z,13625544,False,364523,13664,3:31,Billie Eilish Oxytocin Official Lyric Video
FpeZsTo5hZw,,,,,,,,,,,Billie Eilish Everybody Dies Official Lyric Video,2021-07-30T04:00:04Z,6035241,False,206869,6215,3:27,Billie Eilish Everybody Dies Official Lyric Video
7AS9r_E0PY4,,,,,,,,,,,Billie Eilish Getting Older Official Lyric Video,2021-07-30T04:00:01Z,17051821,False,402992,11166,4:5,Billie Eilish Getting Older Official Lyric Video
uItbMBBHFmo,,,,,,,,,,,Billie Eilish Happier Than Ever Official Vevo Interview,2021-07-20T23:00:15Z,2207974,False,215991,9979,4:7,Billie Eilish Happier Than Ever Official Vevo Interview
SarW9gtWoao,,,,,,,,,,,Billie Eilish Your Power Official Live Performance Vevo,2021-07-18T16:00:10Z,4114982,False,251910,12908,3:58,Billie Eilish Your Power Official Live Performance Vevo
mhTmOdYysSc,,,,,,,,,,,Billie Eilish NDA Live,2021-07-15T23:00:30Z,4670198,False,319517,20624,3:19,Billie Eilish NDA Live
OORBa32WFcM,,,,,,,,,,,Billie Eilish NDA Official Music Video,2021-07-09T04:00:09Z,54574731,False,1815986,100202,3:37,Billie Eilish NDA Official Music Video
b-5Ugpc22mE,,,,,,,,,,,Billie Eilish my future Prime Day Show x Billie Eilish,2021-06-17T23:33:41Z,5396278,False,494245,29671,3:17,Billie Eilish my future Prime Day Show x Billie Eilish
DuPytKRKSFo,,,,,,,,,,,If You Can Solve All These Riddles Youre Legally a Genius,2022-11-02T16:00:47Z,0,False,150,0,P0D,If You Can Solve All These Riddles Youre Legally a Genius
0ScMyZtXhXU,,,,,,,,,,,They Found Titanoboa in a Coal Mine,2022-11-02T16:00:02Z,26468,False,1059,80,9:,They Found Titanoboa in a Coal Mine
MkfLQ8zVpJo,,,,,,,,,,,How to make striking Video Animation Link in comments,2022-11-02T14:02:38Z,7593,False,437,14,21,How to make striking Video Animation Link in comments
ay25SoLaIfc,,,,,,,,,,,A Chilling Journey for Abandoned Places Freaks,2022-11-02T13:00:01Z,12648,False,468,39,9:3,A Chilling Journey for Abandoned Places Freaks
Esd4dgLwWTc,,,,,,,,,,,Which Hand Do You Write With shorts,2022-11-02T12:00:06Z,13242,False,971,36,46,Which Hand Do You Write With shorts
dKgfWi6HNCs,,,,,,,,,,,Crazy Cow Parkour in Tornado Vortex 3D Animation,2022-11-02T11:00:21Z,11885,False,360,59,2:11,Crazy Cow Parkour in Tornado Vortex 3D Animation
rYrgU5k4ZR4,,,,,,,,,,,Is Halleys Comet a Warning of Bad Things to Come,2022-11-01T16:00:24Z,31895,False,981,101,9:18,Is Halleys Comet a Warning of Bad Things to Come
hUWGCv_eOZM,,,,,,,,,,,10 Ways Our Bodies Will Be Different in 100 Years,2022-11-01T13:00:22Z,27537,False,709,102,9:12,10 Ways Our Bodies Will Be Different in 100 Years
UhLynoIt3GU,,,,,,,,,,,If You Have Any of These You Could Be in for Some Cash,2022-11-01T11:00:20Z,21404,False,598,112,8:27,If You Have Any of These You Could Be in for Some Cash
mP_-yRQJHs0,,,,,,,,,,,Why Does Cheese Have Holes shorts,2022-10-31T20:00:24Z,46166,False,2112,29,41,Why Does Cheese Have Holes shorts
hqOz8puVkV0,,,,,,,,,,,50 Creepy Phenomena to Keep You Up at Night,2022-10-31T18:49:32Z,25047,False,348,13,1:1:28,50 Creepy Phenomena to Keep You Up at Night
sAAfiNw4lGg,,,,,,,,,,,Thats Why Leonardo da Vinci Was a Supreme Genius,2022-10-31T16:00:37Z,30927,False,967,92,8:56,Thats Why Leonardo da Vinci Was a Supreme Genius
p5lNBaKeb1w,,,,,,,,,,,17 Tricky Riddles Split My Brain See How You Do,2022-10-31T13:00:38Z,65625,False,967,77,9:35,17 Tricky Riddles Split My Brain See How You Do
MVOp0Ra6i2c,,,,,,,,,,,Whats Up With These WeirdLooking Mushrooms,2022-10-31T11:00:12Z,21463,False,784,171,8:51,Whats Up With These WeirdLooking Mushrooms
iG3cLijvMMU,,,,,,,,,,,How Strong Is Your Hair,2022-10-30T18:00:16Z,42973,False,1985,25,55,How Strong Is Your Hair
g4XQRNXSbWo,,,,,,,,,,,These Creatures Are the Greatest Survivors of Evolution,2022-10-30T16:00:20Z,32008,False,829,95,9:14,These Creatures Are the Greatest Survivors of Evolution
84kpXwmJ4nI,,,,,,,,,,,Solve All 22 Riddles to Awaken Your Magic Powers,2022-10-30T13:00:04Z,57822,False,969,159,12:17,Solve All 22 Riddles to Awaken Your Magic Powers
8qS9C6TmNfA,,,,,,,,,,,9 Most Impressive Impact Craters on Earth,2022-10-30T11:00:10Z,23464,False,767,49,9:11,9 Most Impressive Impact Craters on Earth
0srTA7Ota4Y,,,,,,,,,,,Cooking Tip To Restore Your Confidence In Cooking shorts,2022-10-29T19:30:00Z,67045,False,2812,32,20,Cooking Tip To Restore Your Confidence In Cooking shorts
b3dSE7XN88I,,,,,,,,,,,13 Riddles to Test Your Deduction Skills,2022-10-29T16:00:25Z,62466,False,842,115,10:47,13 Riddles to Test Your Deduction Skills
IBHFOJxLZRU,,,,,,,,,,,What If You Got Animal Superpowers,2022-10-29T13:00:11Z,27221,False,777,109,8:11,What If You Got Animal Superpowers
euVJEpVZ0fE,,,,,,,,,,,A Skyscraper That Changes Its Shape 17 Weird Buildings Around the World,2022-10-29T11:00:34Z,74459,False,1374,137,9:,A Skyscraper That Changes Its Shape 17 Weird Buildings Around the World
-NXuEZV7FzU,,,,,,,,,,,If You See This Spiky Tree Get Away Immediately,2022-10-28T16:00:01Z,58732,False,1207,118,8:56,If You See This Spiky Tree Get Away Immediately
7GznnYrSOJc,,,,,,,,,,,Learn how to work smarter not harder Link in comments,2022-10-28T14:45:31Z,36309,False,1379,17,20,Learn how to work smarter not harder Link in comments
QA23Omjg7Hg,,,,,,,,,,,What Would Happen to Your Body If 1000 Mosquitoes Bite You,2022-10-28T13:00:14Z,38191,False,942,95,9:3,What Would Happen to Your Body If 1000 Mosquitoes Bite You
3zLBQJVAaGY,,,,,,,,,,,We Gave Up Trying to Crack All 17 Riddles,2022-10-28T11:00:04Z,79327,False,1004,117,10:27,We Gave Up Trying to Crack All 17 Riddles
2Uu0LvPOV2I,,,,,,,,,,,Why Some Foods Go Boom in the Microwave,2022-10-27T16:00:02Z,35415,False,940,55,9:55,Why Some Foods Go Boom in the Microwave
yqCVCvMcNJM,,,,,,,,,,,They Are Building a Sea City in the Desert But Why,2022-10-27T13:00:45Z,27922,False,745,39,8:53,They Are Building a Sea City in the Desert But Why
l9n_t8vFEIE,,,,,,,,,,,This Fresh Riddle Is Easier Than You Think shorts,2022-10-27T12:00:26Z,37105,False,1595,33,33,This Fresh Riddle Is Easier Than You Think shorts
VCkI5ci4rmE,,,,,,,,,,,How to Survive If Your Parachute Fails to Open,2022-10-27T11:00:14Z,33354,False,841,72,8:45,How to Survive If Your Parachute Fails to Open
_JkzIfMreLI,,,,,,,,,,,95 Riddles If Youre Up for a Brainteasing Challenge,2022-10-26T19:08:31Z,0,False,66,0,P0D,95 Riddles If Youre Up for a Brainteasing Challenge
VrxJqUpXW0Q,,,,,,,,,,,48 Times People Found Something Extremely Huge,2022-10-26T16:00:15Z,39200,False,730,85,9:37,48 Times People Found Something Extremely Huge
knEOkjWqFN0,,,,,,,,,,,Is This Mysterious Rock Actually from Space,2022-10-26T13:00:36Z,27035,False,746,83,8:51,Is This Mysterious Rock Actually from Space
oBVsbb6hW9M,,,,,,,,,,,13 Detective Riddles to Get Your Prefrontal Cortex Working,2022-10-26T11:00:37Z,36097,False,646,55,10:3,13 Detective Riddles to Get Your Prefrontal Cortex Working
Hu-Vkr09EkE,,,,,,,,,,,Mysterious Doll Found in 1889 Baffles Scientists to This Day,2022-10-25T16:00:09Z,42156,False,1224,69,9:19,Mysterious Doll Found in 1889 Baffles Scientists to This Day
LGqs9d7sa1Y,,,,,,,,,,,16 Rarest and Most Expensive Mining Finds,2022-10-25T13:00:25Z,40802,False,1099,83,8:51,16 Rarest and Most Expensive Mining Finds
N05Sx91VcKQ,,,,,,,,,,,A Logical Puzzle for the Most Brilliant Minds shorts,2022-10-25T12:00:11Z,36171,False,1440,29,34,A Logical Puzzle for the Most Brilliant Minds shorts
SM9KKX-r8CY,,,,,,,,,,,How Heavy of a Weight Can Birds Lift,2022-10-25T11:00:16Z,23419,False,642,73,8:24,How Heavy of a Weight Can Birds Lift
87NoZLLgXls,,,,,,,,,,,The Milky Ways Plasma Bubbles May Slow Star Formation,2022-10-24T18:00:03Z,40812,False,1901,19,51,The Milky Ways Plasma Bubbles May Slow Star Formation
-Fpaze43kqE,,,,,,,,,,,20 ScaryGood Halloween Riddles Thatll Crack You Up,2022-10-24T16:00:00Z,71386,False,1118,84,11:50,20 ScaryGood Halloween Riddles Thatll Crack You Up
n_og8_5_Hfs,,,,,,,,,,,This Dungeons Dragons Game Has Been Running for 40 Years,2022-10-24T13:00:35Z,27645,False,734,48,8:11,This Dungeons Dragons Game Has Been Running for 40 Years
fEEA-m7knOM,,,,,,,,,,,Stories Behind the Most Famous Photos in History,2022-10-24T11:00:26Z,32535,False,782,67,8:49,Stories Behind the Most Famous Photos in History
WEtnCJXPTMI,,,,,,,,,,,Why DeExtinction Is Impossible But Could Work Anyway,2022-10-23T16:00:31Z,55866,False,1361,128,8:44,Why DeExtinction Is Impossible But Could Work Anyway
Zb1F6uNkEmM,,,,,,,,,,,Mars And Antarctica Are Warmer Than This City,2022-10-23T11:00:19Z,32124,False,840,130,9:23,Mars And Antarctica Are Warmer Than This City
etvLAy97kiA,,,,,,,,,,,These Chilling Photos Reveal a Different Side to History,2022-10-22T16:00:24Z,44151,False,1083,128,8:59,These Chilling Photos Reveal a Different Side to History
SrUDD7XQoho,,,,,,,,,,,A New Mystery on Neptune Even NASA Cant Explain,2022-10-22T13:00:15Z,43185,False,1200,135,9:16,A New Mystery on Neptune Even NASA Cant Explain
sxeVJS25F20,,,,,,,,,,,This 500YearOld Village Looks Frozen in Time,2022-10-22T11:00:36Z,26775,False,790,117,9:9,This 500YearOld Village Looks Frozen in Time
glosBGxRHAc,,,,,,,,,,,This Place Hides What Could Save the Whole World,2022-10-21T16:00:27Z,50761,False,1134,98,9:58,This Place Hides What Could Save the Whole World
SoIlvYQZ2pA,,,,,,,,,,,What Its Really Like to Be a Member of the Royal Guard,2022-10-21T13:00:30Z,214675,False,1337,123,8:11,What Its Really Like to Be a Member of the Royal Guard
Oof6RqMiT0U,,,,,,,,,,,You Can Break A Glass With Your Voice shorts,2022-10-21T12:00:25Z,71266,False,2368,30,18,You Can Break A Glass With Your Voice shorts
u6opOMYVGk8,,,,,,,,,,,Food Coloring in SALT WATER Looks WEIRD,2022-11-01T19:48:55Z,34918,False,1402,31,37,Food Coloring in SALT WATER Looks WEIRD
BByQpFa4A0o,,,,,,,,,,,Carving a Pumpkin with a Power Washer,2022-10-26T19:02:29Z,47541,False,1524,42,37,Carving a Pumpkin with a Power Washer
8BUZNDvnESs,,,,,,,,,,,Is THIS the Most Comfortable Bed,2022-10-21T20:00:03Z,76317,False,2173,173,8:9,Is THIS the Most Comfortable Bed
aoG7oGFU0Ig,,,,,,,,,,,DID YOU PICK THE RIGHT ONE,2022-10-18T19:14:16Z,52947,False,1332,26,23,DID YOU PICK THE RIGHT ONE
mPsqXh0TJsM,,,,,,,,,,,What Happens When You SUPER FREEZE Sand,2022-10-14T19:00:31Z,53035,False,1510,140,8:54,What Happens When You SUPER FREEZE Sand
G6aJhqsKCaQ,,,,,,,,,,,THE CHIPOTLE HACK,2022-10-11T19:28:35Z,57022,False,1868,88,50,THE CHIPOTLE HACK
ZOkJnYWKf_Y,,,,,,,,,,,THIS Concrete FLOATS,2022-10-07T19:00:23Z,73173,False,1643,200,12:7,THIS Concrete FLOATS
mlLP_pXI-iw,,,,,,,,,,,Change the Snack Game FOREVER,2022-09-30T19:00:30Z,52611,False,1330,119,6:29,Change the Snack Game FOREVER
vjwftPAPf5U,,,,,,,,,,,Matches That Burn WET,2022-09-27T17:31:47Z,61202,False,2243,31,20,Matches That Burn WET
dj7QrRrx9K0,,,,,,,,,,,EMERGENCY Burrito Bowl,2022-09-21T19:00:30Z,62157,False,1705,250,12:53,EMERGENCY Burrito Bowl
Osq83sUV-Cs,,,,,,,,,,,This Visual Phenomenon Looks UNREAL,2022-09-20T19:00:15Z,74331,False,2094,34,23,This Visual Phenomenon Looks UNREAL
4zQPMJWoqNY,,,,,,,,,,,The Fastest Way to Empty a Bottle,2022-09-13T18:29:51Z,115466,False,2640,51,18,The Fastest Way to Empty a Bottle
k77GBlq31xE,,,,,,,,,,,Take a Picture with a Cardboard Box,2022-09-12T18:59:52Z,38147,False,1240,116,9:52,Take a Picture with a Cardboard Box
re3FhquYORw,,,,,,,,,,,What Happens If You Build Cardboard Shoes,2022-09-02T19:00:21Z,64690,False,1518,228,12:42,What Happens If You Build Cardboard Shoes
EAAMYB6nW40,,,,,,,,,,,Acetone MELTS Styrofoam,2022-08-30T17:39:48Z,77683,False,1784,101,29,Acetone MELTS Styrofoam
gcd3IBIJzos,,,,,,,,,,,Giving FIRE a SHADOW,2022-08-26T19:00:28Z,95804,False,2218,192,10:4,Giving FIRE a SHADOW
TPvPtJxGsyg,,,,,,,,,,,SATISFYING Trick with Water and Oil,2022-08-23T18:24:11Z,104450,False,1979,30,13,SATISFYING Trick with Water and Oil
AdYSCqHIcSs,,,,,,,,,,,Debunking Rock Paper Scissors,2022-08-19T19:30:00Z,56824,False,1432,248,9:50,Debunking Rock Paper Scissors
PFd5XXkFda8,,,,,,,,,,,How to Hold Boiling Water,2022-08-16T18:09:20Z,119057,False,2580,90,13,How to Hold Boiling Water
QTi0ocyd0r8,,,,,,,,,,,Superglue and Fingerprints Have a WEIRD Reaction,2022-08-12T19:00:10Z,56087,False,1381,161,8:40,Superglue and Fingerprints Have a WEIRD Reaction
TzRq2dKha2c,,,,,,,,,,,EASY HOMEMADE ROCKET,2022-08-09T17:21:46Z,97372,False,3771,76,20,EASY HOMEMADE ROCKET
RgqhBJ9AWVU,,,,,,,,,,,How do BANANAS exist,2022-08-05T19:00:09Z,70271,False,2026,241,13:41,How do BANANAS exist
CbmmJfWdp-E,,,,,,,,,,,Lifting an Egg Yolk with Garlic,2022-08-02T19:11:37Z,118641,False,3293,107,18,Lifting an Egg Yolk with Garlic
mPSO7vmbZ-4,,,,,,,,,,,Frozen Bubbles in 103 Weather,2022-07-29T19:00:30Z,77546,False,2192,160,8:1,Frozen Bubbles in 103 Weather
pCAwYNtlO2o,,,,,,,,,,,The WILDEST Liquid EVER,2022-07-26T20:09:00Z,100050,False,2572,65,19,The WILDEST Liquid EVER
lYSDTfQFxA8,,,,,,,,,,,Exploring WEIRD Properties of SOFT METALS,2022-07-22T19:00:27Z,60907,False,1632,139,8:1,Exploring WEIRD Properties of SOFT METALS
o1mKkPicUeY,,,,,,,,,,,The Real WINNER of Rock Paper Scissors,2022-07-19T19:00:45Z,142117,False,3203,213,33,The Real WINNER of Rock Paper Scissors
OMrsX4-eH_s,,,,,,,,,,,Turning a Lethal FIRE TORNADO Pink,2022-07-15T19:00:15Z,93465,False,2377,137,11:35,Turning a Lethal FIRE TORNADO Pink
0vygjHj1Vlk,,,,,,,,,,,This is Hiding in Your Backyard,2022-07-12T17:12:31Z,146535,False,3182,107,14,This is Hiding in Your Backyard
2tmoQHfsCgA,,,,,,,,,,,Making Glass DISAPPEAR with OIL,2022-07-05T20:00:01Z,142405,False,3059,83,8,Making Glass DISAPPEAR with OIL
